partnerCode;shopName;shopAddress;workingHours;latitude;longitude
YP05;Мрмск Северное Нагорное;183050, Мурманская обл, Мурманск г, Кольский пр-кт, дом № 158, корпус 1 МФК Северное Нагорное;Пн-Вс (10:00-22:00);68,913851;33,095956
GB94;Пермь Соликамск Европа;618553, Пермский край, Соликамск г, Северная ул, дом № 55, помещение № 38 ТЦ Европа;Пн-Вс (10:00-21:00);59,700294;56,715326
N516;НСО Искитим Юбилейная ЕС;633200, Искитим г, Юбилейная ул 2;Пн-Вс (09:00-20:00);54,63267;83,30289
LT44;Томск Колпашево2;636460, Томская обл, Колпашевский р-н, Колпашево г, Победы ул, дом № 1;Пн-Вс (09:00-21:00);58,314707;82,90391
YD89;Воронеж ТРЦ Галерея Чижова;394000, Воронежская обл, Воронеж г, Кольцовская ул, дом № 35;Пн-Вс (10:00-22:00);51,666188;39,191933
N388;Ирк Усть-Кут Реброва-Денисова ЕС;666780, Усть-Кут г, Реброва-Денисова ул 3а;Пн-Вс (10:00-20:00);56,77932;105,74582
MI32;Люберцы Инициативная ЕС;140000, Люберцы г, Инициативная ул 14 стр 3;Пн-Вс (09:00-21:00);55,68316;37,89854
L252;Домодедово Барыбино;142060, Московская обл, Домодедово г, Барыбино мкр, Вокзальная 1-я ул, дом № 28Б;Пн-Вс (10:00-19:00);55,2704;37,894152
GC06;Пермь Чернушка2;617830, Пермский край, Чернушинский р-н, Чернушка г, Юбилейная ул, дом № 6а;Пн-Вс (10:00-20:00);56,51962;56,07874
YO36;Архск Коряжма Пушкина;165650, Архангельская обл, Коряжма г, Пушкина ул, дом № 8;Пн-Вс (09:00-21:00);61,313694;47,169889
GN03;Крнд Армавир Красная Площадь;352922, Краснодарский край, Армавир г, Воровского ул, дом № 69 ТРЦ Красная Площадь;Пн-Вс (10:00-22:00);44,983057;41,096721
GE36;ЯНАО Салехард4 Апельсин;629007, Ямало-Ненецкий АО, Салехард г, Ленина ул, дом № 44 ТЦ Апельсин;Пн-Вс (10:00-20:00);66,525829;66,599236
YB28;Кирсанов2;393360, Тамбовская обл, Кирсанов г, Красноармейская ул, дом № 18, помещение 2;Пн-Вс (08:00-20:00);52,650422;42,727064
YR47;СПб Приморск;188910, Ленинградская обл, Выборгский р-н, Приморск г, Выборгское ш павильон у дома №4;Пн-Вс (10:00-20:00);60,367709;28,606482
GA92;ЕК Первоуральск5;623104, Свердловская обл, Первоуральск г, Ватутина ул, дом № 38;Пн-Вс (10:00-20:00);56,904365;59,943504
GA98;ЕК Полевской4;623380, Свердловская обл, Полевской г, Зеленый Бор-1 мкр, дом № 4а помещение 4;Пн-Вс (10:00-21:00);56,504903;60,263819
LA91;РТ Йошкар-Ола ТЦ Планета;424003, Марий Эл Респ, Йошкар-Ола г, Баумана ул, дом № 16;Пн-Вс (10:00-21:00);56,64101;47,843455
KG50;Ствр Благодарный Первомайская ЕС;356420, Благодарный г, Первомайская ул 26;Пн-Вс (09:00-19:00);45,10158;43,43707
U434;Пермь Красновишерск ЕС;618593,  Пермский край, Красновишерский район, г.Красновишерск, ул.Гагарина 87а (павильон);Пн-Вс (09:00-19:00);60,41895;57,08382
K717;Крнд Адлер Голубые Дали2 ЕС;354340, Сочи г, Адлерский р-н Голубые Дали мкр, д.8/5;Пн-Вс (09:00-21:00);43,45359;39,90803
I029;ПВЗ Крнд ТЦ Центр города;350000, Краснодарский край, Краснодар г, Красная ул, дом № 176 лит.1;Пн-Вс (10:00-22:00);45,046871;38,980029
LT49;Бур Улан-Удэ КТК Гэлакси;670000, Бурятия Респ, Улан-Удэ г, Балтахинова ул, дом № 15;Пн-Вс (10:00-20:00);51,826527;107,589659
S982;СПб Кировск ТЦ Набережный  ЕС;187340, Кировск г, Набережная ул 15;Пн-Вс (10:00-20:00);59,88248;30,98486
P401;РТ Белебей Ленина2 ЕС;452006, Белебей г, Ленина ул 32;Пн-Вс (09:00-21:00);54,10452;54,10969
NE91;Крск Вавилова ЕС;г. Красноярск, ул. Вавилова, 1, стр. 39;Пн-Вс (10:00-20:00);55,99175;92,91025
RH49;Орел Металлургов ЕС;302038, Орел г, Металлургов ул 20;Пн-Вс (09:00-20:00);53,01271;36,14447
N335;КО Прокопьевск Шахтеров2 ЕС;653000, Прокопьевск г, Шахтеров пр-кт 37;Пн-Вс (09:00-20:00);53,88509;86,74965
P151;РТ Уфа ТЦ Тополя ЕС;450000, Уфа г, Коммунаров ул 61;Пн-Вс (10:00-20:00);54,81642;56,12395
L305;Красногорск Подмосковный бульвар;143405, Московская обл, Красногорский р-н, Красногорск г, Подмосковный б-р, дом № 10;Пн-Вс (10:00-21:00);55,82135;37,370769
GM24;КЧР Усть-Джегута;369300, Карачаево-Черкесская Респ, Усть-Джегутинский р-н, Усть-Джегута г, Курортная ул, дом № 184;Пн-Вс (08:00-20:00);44,085;41,976684
UR05;ЕК Камышлов2 ЕС;624860, Камышлов г, Ленина ул 30;Пн-Вс (09:00-21:00);56,8464;62,71217
S992;Архск Северодвинск ТК Россия ЕС;164509, Северодвинск г, Мира ул 15;Пн-Пт (10:00-19:00), Сб-Вс (10:00-18:00);64,59552;39,81055
KD58;ЧР Аргун Беркат ЕС;366310, Аргун г, Шоссейеая ул. напротив дома 113;Пн-Вс (09:00-19:00);43,27769;45,87313
NE27;КО Тяжинский ЕС;Тяжинский пгт, Железнодорожная ул 14;Пн-Вс (09:00-19:00);56,11431;88,51555
U941;Пермь Ивана Франко ЕС;614056, Пермь г, Ивана Франко 38;Пн-Вс (09:00-21:00);58,06362;56,35454
MF90;Дубровка Сосновая ЕС;142770, Москва г, Сосновая ул 6;Пн-Вс (10:00-21:00);55,57187;37,45179
LQ43;Збк Шилка;673370, Забайкальский край, Шилкинский р-н, Шилка г, Ленина ул, дом № 29;Пн-Вс (09:00-20:00);51,853465;116,028187
LQ35;Збк Карымское;673302, Забайкальский край, Карымский р-н, Карымское пгт, Ленинградская ул, дом № 38;Пн-Вс (09:00-21:00);51,626555;114,350536
LQ99;Ирк ТЦ Сезон;664011, Иркутская обл, Иркутск г, Свердлова ул, дом № 36 помещение №11;Пн-Вс (10:00-19:00);52,286385;104,288265
GB03;ЕК Радуга Парк;620000, Свердловская обл, Екатеринбург г, Репина ул, дом № 94, 1 этаж, помещение 207;Пн-Вс (10:00-22:00);56,816441;60,538446
GM74;Рнд Константиновск Комарова;347250, Ростовская обл, Константиновский р-н, Константиновск г, Комарова ул, дом № 47Г;Пн-Вс (08:00-19:00);47,577086;41,10026
LR06;Ирк Усолье-Сибирское Луначарского;665462, Иркутская обл, Усолье-Сибирское г, Красных Партизан пр-кт, дом № 24 в торцевой части жилого дома № 24;Пн-Вс (09:00-21:00);52,73248;103,656677
GM59;РнД Доломановский 000;344000, Ростовская обл, Ростов-на-Дону г, Мечникова ул, дом № 130/141 Комсомольская Площадь;Пн-Вс (09:00-21:00);47,237419;39,697585
YA49;Воронеж Свободы 000;394018, Воронежская обл, Воронеж г, Фридриха Энгельса ул, дом № 64, корпус а ТЦ Атмосфера, 1 этаж, вход со стороны ул. Куколкина;Пн-Вс (09:00-21:00);51,663646;39,195059
LS12;Крск Мира 000 2;660000, Красноярский край, Красноярск г, Мира пр-кт, дом № 132 пом. 138;Пн-Вс (09:00-21:00);56,010594;92,838711
LZ05;Хабаровск НК СИТИ 000;680030, Хабаровский край, Хабаровск г, Ленина ул, дом № 75;Пн-Вс (10:00-20:00);48,481944;135,09021
LB96;РТ Самара Русь 000;443069, Самарская обл, Самара г, Авроры ул, дом № 110, корпус 1 Железнодорожный район;Пн-Вс (09:00-21:00);53,193558;50,189207
YP72;СПб Коломяжский 13 000;195112, Санкт-Петербург г, Новочеркасский пр-кт, дом № 33, корпус 3, литер А;Пн-Вс (09:00-21:00);59,931174;30,406571
GD18;Члб Воровского 000;454000, Челябинская обл, Челябинск г, Сони Кривой ул, дом № 83;Пн-Вс (09:00-21:00);55,156955;61,368184
LE45;СРТ Сакко 000;410056, Саратовская обл, Саратов г, Сакко и Ванцетти ул, дом № 31;Пн-Вс (09:00-21:00);51,52945;46,027322
GA11;ЕК 8 марта 000;620075, Свердловская обл, Екатеринбург г, Карла Либкнехта ул, дом № 22;Пн-Вс (09:00-21:00);56,840783;60,612458
LA99;РТ Казань Колизей 000;420021, Татарстан Респ, Казань г, Татарстан ул, дом № 18;Пн-Вс (09:00-21:00);55,78196;49,11405
GO39;Крнд Красная 000;350000, Краснодарский край, Краснодар г, Северная ул, дом № 510;Пн-Вс (09:00-21:00);45,03633;38,999316
LQ58;Ирк Байкальская 000;664007, Иркутская обл, Иркутск г, Карла Маркса ул, дом № 45;Пн-Вс (09:00-21:00);52,28967;104,293677
LE30;СРТ Вольск Октябрьская;412900, Саратовская обл, Вольск г, Октябрьская ул, дом № 108А;Пн-Вс (09:00-20:00);52,041535;47,393331
GC64;ХМАО Мегион2;"628681, Ханты-Мансийский Автономный округ - Югра АО, Мегион г, Строителей ул, дом № 13/4 магазин ""Мини-Маркет""";Пн-Вс (09:00-19:00);61,028217;76,112433
GC65;ХМАО Мегион3;628684, Ханты-Мансийский Автономный округ - Югра АО, Мегион г, Заречная ул, дом № 15/3;Пн-Вс (09:00-19:00);61,033132;76,101025
LP87;Прим Спасск-Дальний;692245, Приморский край, Спасск-Дальний г, Борисова ул, дом № 23;Пн-Вс (09:00-20:00);44,597878;132,816463
P663;СРТ Калининск Советская2 ЕС;412450, Калининск г, Советская ул 11;Пн-Вс (09:00-19:00);51,4983;44,48398
GO53;Ствр Новопавловск;357300, Ставропольский край, Кировский р-н, Новопавловск г, Центральная ул, дом № 53;Пн-Вс (08:00-19:00);43,959726;43,632223
SD01;СПб Приозерск Северопарковая ЕС;188760, Приозерск г, Северопарковая ул 1;Пн-Вс (09:00-21:00);61,03974;30,13119
LC82;РТ Уфа ТРЦ Аркада;450022, Башкортостан Респ, Уфа г, Минигали Губайдуллина ул, дом № 8 ТЦ Аркада;Пн-Вс (10:00-22:00);54,721819;55,996881
LD55;НН Дзержинск ТЦ Юбилейный;606000, Нижегородская обл, Дзержинск г, Чкалова пр-кт, дом № 23 ТЦ Юбилейный;Пн-Вс (09:00-19:00);56,248063;43,463786
K418;Влд Урюпинск Штеменко ЕС;403113, Урюпинск г, Штеменко ул 2В;Пн-Вс (09:00-20:00);50,7984;42,00564
LZ02;Хабаровск ЖД Вокзал;680021, Хабаровский край, Хабаровск г, Амурский б-р, дом № 66, помещение I (57-63);Пн-Вс (09:00-20:00);48,494888;135,072932
L542;ТЦ Дискавери;125475, Москва г, Дыбенко ул, дом № 7, строение 1 ТЦ Дискавери;Пн-Вс (10:00-22:00);55,879086;37,480346
GB77;Пермь Куйбышева 000;614016, Пермский край, Пермь г, Куйбышева ул, дом № 65;Пн-Вс (09:00-21:00);57,998395;56,242361
LC07;РТ Сарапул Магнит Карла Маркса;427960, Удмуртская Респ, Сарапул г, Азина ул, дом № 55а;Пн-Вс (09:00-20:00);56,467454;53,807397
K133;Крнд Сочи ТЦ Татулян ЕС;354000, Сочи г, Ленина ул 1;Пн-Вс (09:00-21:00);43,42555;39,92589
K903;РнД Шахты Победа Революции ЕС;346500, Шахты г, Победа Революции пр-кт 99А;Пн-Вс (08:00-21:00);47,70679;40,21442
K115;Крнд Славянск-на-Кубани Красная ЕС;353560, Славянск-на-Кубани г, Красная ул 4;Пн-Вс (08:00-19:00);45,26185;38,13218
K330;РнД Батайск Кирова ЕС;346880, Батайск г, Кирова ул 8;Пн-Вс (08:00-20:00);47,13844;39,75292
L531;ТРЦ Щелковский2;105122, Москва г, Щелковское ш, владение № 75;Пн-Чт (10:00-22:00), Пт-Сб (10:00-23:00), Вс (10:00-22:00);55,805311;37,763132
K712;Крнд Лазаревское4 ЕС;354200, Сочи г, Лазаревское п, Лазарева ул, 88;Пн-Вс (09:00-20:00);43,91534;39,32135
LE62;РТ Бакалы;452650, Башкортостан Респ, Бакалинский р-н, Бакалы с, Мостовая ул, дом № 2;Пн-Сб (09:00-18:00), Вс (09:00-16:00);55,176094;53,80371
UR54;Пермь Яйва ЕС;618340, Яйва пгт, Парковая ул 8;Пн-Вс (09:00-21:00);59,33151;57,26515
LT11;Хкс Абаза;655750, Хакасия Респ, Абаза г, Лазо ул, дом № 2г;Пн-Вс (09:00-20:00);52,650441;90,08731
K640;Крнд Курганинск Комсомольская ЕС;352430, Курганинск г, Комсомольская ул 37 (ЕС);Пн-Вс (09:00-20:00);44,88188;40,58954
K850;Крнд Армавир Кирова2 ЕС;352900, Армавир г, Кирова ул 53;Пн-Вс (08:00-20:00);44,99716;41,13067
P111;СРТ Дачная ЕС;410052, Саратов г, 3-я Дачная ул. Остановка;Пн-Вс (10:00-22:00);51,57736;45,9735
GO03;РнД Таганрог Русское поле2;347900, Ростовская обл, Таганрог г, Чехова ул, дом № 320-5, литера А;Пн-Вс (08:00-20:00);47,221252;38,867174
LE07;ПНЗ Кузнецк Центральный рынок;442530, Пензенская обл, Кузнецк г, Белинского ул, дом № 225;Пн-Вс (09:00-19:00);53,112568;46,615736
YA46;Владимир21;600005, Владимирская обл, Владимир г, Тракторная ул, дом № 45;Пн-Вс (10:00-22:00);56,1492;40,387096
GC58;ХМАО Когалым3;628484, Ханты-Мансийский Автономный округ - Югра АО, Когалым г, Ленинградская ул, дом № 21;Пн-Вс (09:00-21:00);62,260916;74,474865
K515;Крнд Кореновск Эстрадный ЕС;353182, Кореновск г, Эстрадный пер 1;Пн-Вс (08:00-19:00);45,46704;39,44897
YB56;Курск29;305018, Курская обл, Курск г, Харьковская ул, дом № 3;Пн-Вс (09:00-21:00);51,674124;36,145359
GL10;Адг Ашан;385132, Адыгея Респ, Тахтамукайский р-н, Новая Адыгея аул, Тургеневское шоссе ул, дом № 27 ТЦ Мега Ашан;Пн-Вс (08:30-22:00);45,013289;38,929057
YR46;СПб Подпорожье;187780, Ленинградская обл, Подпорожский р-н, Подпорожье г, Октябрят ул, дом № 9;Пн-Вс (09:00-19:00);60,909748;34,161628
LS91;Томск Асино Ленина;636840, Томская обл, Асино г, им Ленина ул, дом № 32 помещение 35;Пн-Вс (09:00-21:00);56,998731;86,145015
LB77;РТ Отрадный Атмосфера;446300, Самарская обл, Отрадный г, Советская ул, дом № 95 А;Пн-Вс (08:00-20:00);53,372688;51,355212
YD15;Торжок2;172001, Тверская обл, Торжок г, Степана Разина ул, дом № 2-4;Пн-Вс (09:00-19:00);57,043023;34,96788
LT19;Хкс Абакан Щетинкина2;655017, Хакасия Респ, Абакан г, Щетинкина ул, дом № 59, пом. 201Н;Пн-Вс (09:00-21:00);53,728337;91,440922
LT31;Чита ТЦ Фортуна;672014, Забайкальский край, Чита г, Недорезова ул, дом № 1м;Пн-Вс (10:00-22:00);52,035909;113,47059
L344;Можайск2;143200, Московская обл, Можайский р-н, Можайск г, Красных Партизан ул, дом № 1;Пн-Вс (09:00-19:00);55,50633;36,017558
LA93;РТ Ишимбай Аструм2;453215, Башкортостан Респ, Ишимбайский р-н, Ишимбай г, Стахановская ул, дом № 92;Пн-Вс (10:00-20:00);53,449732;56,03729
GO12;Крнд Белореченск Мира;352630, Краснодарский край, Белореченский р-н, Белореченск г, Мира ул, дом № 75;Пн-Вс (08:00-20:00);44,763738;39,869221
LA92;РТ Йошкар-Ола Центральный рынок;424000, Марий Эл Респ, Йошкар-Ола г, Первомайская ул, дом № 115;Пн-Вс (08:00-20:00);56,633216;47,884813
LE37;СРТ Маркс Ленина;413090, Саратовская обл, Маркс г, Ленина пр-кт, дом № 78 А;Вт-Ср (09:00-20:00), Пт-Вс (09:00-20:00);51,704293;46,755862
L139;ТРЦ Колумбус;117519, Москва г, Кировоградская ул, дом № 13А ТРЦ Колумбус;Пн-Вс (10:00-22:00);55,611554;37,608387
N329;Омск Карла Маркса ЕС;644010, Омск г, Карла Маркса пр-кт 29;Пн-Вс (09:00-22:00);54,97348;73,38267
GE43;Тмн Винзили;625530, Тюменская обл, Тюменский р-н, Винзили рп, Заводская ул, дом № 20а, корпус 1;Пн-Вс (09:00-19:00);56,953414;65,768906
LQ85;Ирк Розы Люксембург2;664013, Иркутская обл, Иркутск г, Розы Люксембург ул, у дома №217 а;Пн-Вс (09:00-21:00);52,350333;104,174084
GM62;РнД Егорлыкская;347664, Ростовская обл, Егорлыкский р-н, Егорлыкская ст-ца, Ворошилова ул, дом № 77;Пн-Вс (08:00-18:00);47,273502;41,666266
GE41;ЕК Бисерть ТЦ Кристалл;623050, Свердловская обл, Нижнесергинский р-н, Бисерть рп, Тимирязева ул, дом № 18, корпус а;Пн-Вс (10:00-18:00);56,846212;59,062241
GB70;Пермь Ипподром;614000, Пермский край, Пермь г, Мира ул, дом № 132, литера Б63;Пн-Вс (09:00-19:30);57,970139;56,156687
N201;Крск Курагино2 ЕС;662911, Курагино рп, Гагарина пер 29;Пн-Вс (09:00-19:00);53,89098;92,68065
UR69;ЕК Химмаш ЕС;620010, Свердловская обл, Екатеринбург г, Грибоедова ул, дом № 20;Пн-Вс (09:00-21:00);56,754054;60,701582
LP54;Магд Ленина;685000, Магаданская обл, Магадан г, Ленина пр-кт, дом № 14, помещение 1,4-7;Пн-Вс (10:00-20:00);59,565786;150,804734
N477;Алтай Горно-Алтайск ТЦ Горный2 ЕС;649000, Горно-Алтайск г, Коммунистическая ул 109/2;Пн-Вс (09:00-20:00);51,96207;85,91259
L093;Перекресток Коммунарка;142770, Москва г, Сосенское п, Коммунарка п, Александры Монаховой ул, домовладение № 30, строение 2 ТЦ Перекресток;Пн-Вс (10:00-22:00);55,566662;37,482537
S139;СКТ Воркута Ленина2 ЕС;169906, Воркута г, Ленина ул 35;Пн-Вс (09:00-21:00);67,49587;64,0563
L328;Люберцы ТЦ Выходной;140000, Московская обл, Люберецкий р-н, Люберцы г, Октябрьский пр-кт, дом № 112 ТЦ Выходной;Пн-Вс (10:00-22:00);55,685196;37,877686
L192;ТЦ Щука2;123182, Москва г, Щукинская ул, дом № 42;Пн-Вс (10:00-22:00);55,80946;37,465612
YD63;Старый Оскол ТЦ Боше;"309516, Белгородская обл, Старый Оскол г, Ольминского мкр, дом № 17 ТЦ ""Боше""";Пн-Вс (10:00-21:00);51,308689;37,871352
L160;ТЦ Калейдоскоп;125363, Москва г, Сходненская ул, дом № 56;Пн-Вс (10:00-22:00);55,850436;37,444071
NE49;Крск Минусинск Абаканская2 ЕС;662603, Минусинск г, Абаканская ул 53;Пн-Вс (09:00-20:00);53,69163;91,66954
K798;Крнд Тамань Пушкина ЕС;353556, Тамань, Пушкина ул 5;Пн-Вс (09:00-21:00);45,21444;36,71968
N919;Алтай Михайловское ЕС;658960, Михайловское с, Советская ул 5пом.1;Пн-Вс (09:00-19:00);51,82124;79,72369
GM38;РнД Багаевская;346611, Ростовская обл, Багаевский р-н, Багаевская ст-ца, Подройкина ул, дом № 25;Пн-Вс (08:00-19:00);47,323557;40,369581
GO25;РСО Владикавказ ТРЦ Алания Молл2;"362001, Северная Осетия - Алания Респ, Владикавказ г, Московское ш, дом № 3 ""к"" ТРЦ Алания Молл";Пн-Вс (10:00-22:00);43,033368;44,642801
S891;Мрмск Универмаг Волна ЕС;183038, Мурманск г, Ленинградская ул 20/3;Пн-Вс (10:00-21:00);68,9706;33,07158
GB65;Пермь Губаха ТЦ Галеон;618250, Пермский край, Губаха г, Дегтярева ул, дом № 3а;Пн-Вс (09:00-19:00);58,835298;57,549306
GL66;Влд Урюпинск2;403117, Волгоградская обл, Урюпинск г, Штеменко ул, дом № 1А/4;Пн-Вс (09:00-19:00);50,798035;42,004969
X406;Амур Свободный ЕС;676450, Свободный г, Карла Маркса ул 24;Пн-Вс (09:00-20:00);51,37615;128,13728
LP28;Прим Владивосток Луговая;690013, Приморский край, Владивосток г, Трамвайная ул, дом № 14Б;Пн-Вс (09:00-20:00);43,111376;131,938144
GM50;РнД Волгодонск4;347382, Ростовская обл, Волгодонск г, Строителей пр-кт, дом № 21;Пн-Вс (09:00-20:00);47,517525;42,19819
L343;Можайск;143200, Московская обл, Можайский р-н, Можайск г, Железнодорожная 1-я ул, дом № 43;Пн-Вс (09:00-19:00);55,496181;36,031643
YP02;Мрмск Полярные Зори Рынок;184230, Мурманская обл, Полярные Зори г, Энергетиков ул, дом № 27;Пн-Вс (10:00-21:00);67,371206;32,485024
LT06;Тыва Кызыл Кочетова;667000, Тыва Респ, Кызыл г, Кочетова ул, дом № 47;Пн-Вс (09:00-21:00);51,719358;94,440955
LP57;Якутия Мирный Советская;678175, Саха /Якутия/ Респ, Мирнинский у, Мирный г, Советская ул, дом № 6, корпус 1;Пн-Вс (09:00-21:00);62,541764;113,981102
GN41;Ствр Изобильный;356140, Ставропольский край, Изобильненский р-н, Изобильный г, Ленина пер, дом № 12а;Пн-Вс (09:00-19:00);45,370418;41,711363
LP70;Камч Петропавловск Парус;683024, Камчатская обл, Петропавловск-Камчатский г, 50 лет Октября пр-кт, дом № 16/1 ТЦ Парус;Пн-Вс (10:00-20:00);53,057006;158,635007
GN37;Ствр Буденновск2;356800, Ставропольский край, Буденновский р-н, Буденновск г, Менделеева пр-кт, дом № 7;Пн-Вс (09:00-19:00);44,804298;44,156571
S055;Мрмск Заозерск ЕС;184310, Заозерск г, Ленинского Комсомола ул 7;Пн-Вс (10:00-20:00);69,40594;32,44321
W334;Кир Яранск Кирова ЕС;612260, Яранск г, Кирова ул 26;Пн-Пт (09:00-18:00), Сб-Вс (09:00-17:00);57,30435;47,88467
