partnerCode;shopName;shopAddress;workingHours;latitude;longitude
LE51;СРТ ТЦ Оранжевый;410015, Саратовская обл, Саратов г, Им Орджоникидзе Г.К. пл, дом № 1 ТЦ Оранжевый;Пн-Вс (10:00-21:00);51,512161;45,948823
LZ26;Южно-Сахалинск Проспект Победы;693008, Сахалинская обл, Южно-Сахалинск г, Ленина ул, дом № 285;Пн-Вс (09:00-20:00);46,950192;142,731666
GD70;Члб Миасс8;456320, Челябинская обл, Миасс г, Октябрьская ул, дом № 2;Пн-Вт (10:00-20:00), Чт-Сб (10:00-20:00);54,985959;60,102265
GC09;Тмн Ашан;625000, Тюменская обл, Тюмень г, Дмитрия Менделеева ул, дом № 1 ТЦ Ашан;Пн-Пт (10:00-19:00);57,116649;65,551938
YS04;СПб ТЦ Жемчужная Плаза;198206, Санкт-Петербург г, Петергофское ш, дом № 51, литера А ТЦ Жемчужная Плаза;Пн-Вс (10:00-22:00);59,849202;30,144245
R094;Осташков2 ЕС;172730, Осташков г, Загородная ул 2;Пн-Вс (09:00-19:00);57,13987;33,1243
LP59;Прим Находка Ладья;692900, Приморский край, Находка г, Мира пр-кт, дом № 3а;Пн-Пт (10:00-19:00);42,832788;132,894394
L075;Москва Сити Империя;123100, Москва г, Пресненская наб, дом № 6, строение 2 БЦ Империя Тауэр, Москва Сити;Пн-Пт (10:00-19:00);55,748676;37,540196
YA31;Брянск25;241023, Брянская обл, Брянск г, Объездная ул, дом № 30;Пн-Вс (10:00-22:00);53,275746;34,315813
GA07;ЯНАО Новый Уренгой Солнечный;629305, Ямало-Ненецкий АО, Новый Уренгой г, Сибирская ул, дом № 26 Донской мкр, д. № 1;Пн-Вс (10:00-22:00);66,083291;76,630397
YP44;СПб Гатчина ОКЕЙ;188300, Ленинградская обл, Гатчинский р-н, Гатчина г, Ленинградское ш, дом № 12 ТЦ Окей;Пн-Вс (10:00-20:00);59,583589;30,13863
LD08;РТ Янаул Ленина6;452800, Башкортостан Респ, Янаульский р-н, Янаул г, Ленина ул, дом № 6, корпус 2;Пн-Вс (09:00-21:00);56,268211;54,934445
LR45;КО Ленинск-Кузнецкий Пл Победы 2;652500, Кемеровская обл, Ленинск-Кузнецкий г, Кирова пр-кт, дом № 46 Помещение 1;Пн-Ср (09:00-19:00), Пт-Сб (09:00-19:00);54,665932;86,166573
GB58;Пермь Верещагино;"617120, Пермский край, Верещагинский р-н, Верещагино г, Ленина ул, дом № 11 часть помещения магазина ""Маруся"" №1,2, 1 этаж";Пн-Вс (09:00-20:00);58,079913;54,659548
GL79;КБР Прохладный;361041, Кабардино-Балкарская Респ, Прохладный г, Ленина ул (торговый ряд) Торговый ряд;Пн-Вс (09:00-20:00);43,758076;44,007594
K139;КЧР Карачаевск Ленина ЕС;369200, Карачаевск г, Ленина ул 34Г;Пн-Вс (08:00-20:00);43,76969;41,90796
P120;МРД Саранск Гагарина ЕС;430027, Саранск г, Гагарина ул 99a;Пн-Вс (10:00-21:00);54,16601;45,14972
LZ10;Хабаровск ТЦ Горизонт;680000, Хабаровский край, Хабаровск г, Большая ул, дом № 88 ТЦ Горизонт;Вт-Чт (10:00-20:00), Сб-Вс (10:00-20:00);48,505199;135,08548
KD54;Крнд Гулькевичи Комсомольская ЕС;352190, Гулькевичи г, Комсомольская 105;Пн-Вс (08:00-19:00);45,36026;40,69495
N464;Алтай Бийск Васильева2 ЕС;659305, Бийск г, Васильева ул 42;Пн-Вс (09:00-19:00);52,51036;85,14542
N582;Тыва Кызыл Добровольцев4 ЕС;667000, Кызыл г, Тувинских Добровольцев ул 19;Пн-Вс (09:00-20:00);51,71891;94,44194
RG12;Новый Оскол2 ЕС;308000, Белгородская обл. г. Новый Оскол, пл. Революции;Пн-Вс (08:00-19:00);50,76206;37,86469
U664;Пермь ТЦ Столица ЕС;614000, Пермь г, Мира ул 41/1;Пн-Вс (10:00-21:00);57,97735;56,1896
RE31;Щигры2 ЕС;306530, Щигры г, Красная ул 4;Пн-Вс (08:00-19:00);51,87119;36,91812
R023;Владимир ТК Торговые ряды ЕС;600000, Владимир г, Большая Московская ул 19;Пн-Вс (09:00-19:00);56,12829;40,40293
GB45;Крг Пушкинский;640003, Курганская обл, Курган г, Пушкина ул, дом № 25;Пн-Ср (10:00-20:00), Пт-Сб (10:00-20:00);55,432215;65,319094
KI01;ЭЛСТ Элиста4 ЕС;"358000, Элиста г, Ленина ул 239 ""Б""";Пн-Вс (08:00-20:00);46,30809;44,26388
LE42;СРТ Пугачев;413720, Саратовская обл, Пугачев г, МГорького ул, дом № 40;Пн-Вс (08:00-19:00);52,007805;48,810814
P901;МРД Саранск Веселовского ЕС;430000, Саранск г, Веселовского ул 62А;Пн-Вс (09:00-20:00);54,22611;45,13296
N411;Хкс Абакан Шевченко ЕС;655012, Абакан г, Тараса Шевченко ул 62а;Пн-Вс (09:00-20:00);53,72046;91,46064
UR31;Члб Златоуст ТЦ Тарелка ЕС;456209, Златоуст г, Мира пр-т 32/1;Пн-Вс (10:00-20:00);55,12468;59,7002
S025;Калин Черняховск Ленина ЕС;238151, Черняховск г, Ленина ул 16;Ср-Вс (10:00-18:00);54,63489;21,81457
U655;Пермь Березники ТЦ ЦУМ ЕС;618400, Березники г, Пятилетки ул 41;Пн-Вс (10:00-21:00);59,40614;56,80581
L409;Раменское5;140108, Московская обл, Раменский р-н, Раменское г, Советская ул, дом № 16;Пн-Вс (09:00-22:00);55,566486;38,22866
YR24;СПб ОКЕЙ Индустриальный;195298, Санкт-Петербург г, Индустриальный пр-кт, дом № 25, литер А неж. пом. инв. № 49;Пн-Вс (10:00-21:00);59,947129;30,477609
GE02;Члб Фиеста;454138, Челябинская обл, Челябинск г, Молодогвардейцев ул, дом № 7 ТЦ Фиеста;Пн-Вс (10:00-22:00);55,205091;61,32817
LB66;РТ Оренбург - Север;460000, Оренбургская обл, Оренбург г, Дзержинского пр-кт, дом № 23;Пн-Вс (10:00-22:00);51,834135;55,129756
GN77;Крнд Павловская;352040, Краснодарский край, Павловский р-н, Павловская ст-ца, Ленина ул, дом № 24;Пн-Вс (08:00-20:00);46,135969;39,783761
LQ13;Алтай Барнаул Площадь Советов;656049, Алтайский край, Барнаул г, Ленина пр-кт, дом № 51;Пн-Вс (09:00-20:00);53,344739;83,779947
LP53;Магд Грант;685000, Магаданская обл, Магадан г, Гагарина ул, дом № 27 1 этаж магазина;Пн-Вс (09:00-21:00);59,554106;150,810383
GC07;Пермь Чусовой;618200, Пермский край, Чусовой г, Мира ул, дом № 17;Пн-Вс (10:00-20:00);58,269898;57,804091
LR04;Ирк Усолье-Сибирское;665451, Иркутская обл, Усолье-Сибирское г, Интернациональная ул, дом № 40, 62;Пн-Вс (09:00-21:00);52,751621;103,658937
YC03;Новомичуринск;391160, Рязанская обл, Пронский р-н, Новомичуринск г, Энергетиков пр-кт, дом № 41/2;Пн-Пт (09:00-19:00);54,037508;39,751462
GB47;Крг Шадринск2;641870, Курганская обл, Шадринск г, примерно в одиннадцати метрах в восточном направлении от ориентира здание,Комсомольская ул, дом № 17;Пн-Вс (10:00-20:00);56,082694;63,630456
LQ68;Ирк Братск Юнона;665708, Иркутская обл, Братск г, Центральный жилрайон, Кирова ул, дом № 16/30, пом. 1008;Пн-Ср (09:00-21:00), Чт (09:00-19:00), Пт-Сб (09:00-21:00), Вс (09:00-19:00);56,15492;101,623923
LT03;Тыва Кызыл Добровольцев;667000, Тыва Респ, Кызыл г, Тувинских Добровольцев ул, дом № 21;Пн-Вс (08:00-20:00);51,718751;94,441996
L179;ТЦ РИО 2;127204, Москва г, Дмитровское ш, дом № 163а ТЦ РИО;Пн-Вс (10:00-22:00);55,909116;37,539302
GD63;Члб Магнитогорск6;455044, Челябинская обл, Магнитогорск г, Карла Маркса пр-кт, дом № 99;Пн-Вс (10:00-18:00);53,401698;58,978935
LS55;Нсиб ТЦ Зауралье;630112, Новосибирская обл, Новосибирск г, Фрунзе ул, дом № 238 ТЦ Зауралье;Пн-Вс (10:00-22:00);55,03897;82,960728
GD84;Члб Сатка2;456910, Челябинская обл, Саткинский р-н, Сатка г, Индустриальная ул, дом № 1;Пн-Вс (09:00-19:00);55,042045;58,976491
LT21;Збк Борзя;674600, Забайкальский край, Борзинский р-н, Борзя г, Лазо ул, дом № 56;Пн-Вс (09:00-20:00);50,388832;116,524081
LZ27;Южно-Сахалинск Сити Молл;693014, Сахалинская обл, Южно-Сахалинск г, Хомутово п/р, 2-я Центральная ул, дом № 1Б ТЦ Сити Молл;Пн-Вс (10:00-21:00);46,900361;142,742209
GC68;ХМАО Нефтеюганск;628310, Ханты-Мансийский Автономный округ - Югра АО, Нефтеюганск г, 12-й мкр, дом № 29;Пн-Вт (10:00-19:00), Чт-Сб (10:00-19:00);61,100345;72,588827
GE28;ЯНАО Ноябрьск2;"629802, Ямало-Ненецкий АО, Ноябрьск г, Ленина ул, павильоны №5,6, район микрорайона ""И-2""";Пн-Вс (09:00-21:00);63,195945;75,438157
LZ37;Якутск Дзержинского;677000, Саха /Якутия/ Респ, Якутск г, Дзержинского ул, дом № 70;Пн-Вс (09:00-20:00);62,060751;129,742947
GL12;Адг Майкоп СВ3;385000, Адыгея Респ, Майкоп г, Краснооктябрьская ул, дом № 30 Майкоп г, Краснооктябрьская ул, дом № 30/Пролетарская, 233;Пн-Вс (09:00-19:00);44,608713;40,10519
YC71;Сафоново;215500, Смоленская обл, Сафоновский р-н, Сафоново г, Советская ул, дом № 9;Пн-Вс (09:00-20:00);55,109962;33,245124
LP43;Хаб Комсом-на-Амуре Ленина;681013, Хабаровский край, Комсомольск-на-Амуре г, Ленина пр-кт, дом № 32, помещение 1004;Пн-Пт (10:00-20:00);50,550501;137,008135
LR13;Ирк Черемхово;665407, Иркутская обл, Черемхово г, Первомайская ул, дом № 199;Пн-Вс (09:00-21:00);53,170208;103,042063
YO92;Мрмск Кандалакша;184042, Мурманская обл, Кандалакша г, Первомайская ул, дом № 57;Пн-Вс (09:00-20:00);67,152505;32,414415
LS39;Крск Шарыпово;662311, Красноярский край, Шарыпово г, Пионерный мкр, дом № 9;Пн-Вт (09:00-19:00), Чт-Пт (09:00-19:00), Вс (09:00-19:00);55,524753;89,189994
YA92;Дятьково;242600, Брянская обл, Дятьковский р-н, Дятьково г, Ленина ул от Ленина пл;Пн-Вс (09:00-20:00);53,596739;34,338524
LA81;РТ Ижевск Петровский;426068, Удмуртская Респ, Ижевск г, им Петрова ул, дом № 29;Пн-Вс (10:00-22:00);56,871312;53,289642
LS61;НСиб Учительская;630110, Новосибирская обл, Новосибирск г, Богдана Хмельницкого ул, дом № 63А;Пн-Пт (09:00-19:00);55,081777;82,964693
YP77;СПб Колпино ТРК Меркурий;196650, Санкт-Петербург г, Колпино г, Пролетарская ул, дом № 36, Лит. А, ТРК Меркурий;Пн-Вс (10:00-20:00);59,74051;30,583438
YS02;СПб ТЦ Атмосфера;197372, Санкт-Петербург г, Комендантская пл, дом № 1, литер А ТЦ Атмосфера;Пн-Вс (10:00-22:00);60,007772;30,259761
GC40;Тмн ЦУМ;625002, Тюменская обл, Тюмень г, Орджоникидзе ул, дом № 63а ТЦ ЦУМ;Пн-Вс (10:00-21:00);57,148704;65,540968
LQ97;Ирк ТЦ Jam МОЛЛ;664043, Иркутская обл, Иркутск г, Сергеева ул, дом № 3 ТЦ Jam МОЛЛ;Пн-Вс (10:00-21:00);52,265177;104,22299
GL96;Крнд Анапа2;353440, Краснодарский край, Анапский р-н, Анапа г, Красноармейская ул, дом № 15;Пн-Вс (08:00-20:00);44,898591;37,324834
GA12;ЕК Алапаевск;624600, Свердловская обл, Алапаевск г, Братьев Серебряковых ул, дом № 14;Пн-Вс (09:00-19:00);57,851773;61,695117
GB52;Пермь Айсберг;614000, Пермский край, Пермь г, Попова ул, дом № 16 ТЦ Айсберг;Пн-Вс (09:00-21:00);58,008549;56,228164
GC33;Тмн Столица;625000, Тюменская обл, Тюмень г, Московский тракт, дом № 118;Пн-Вс (10:00-22:00);57,135147;65,493796
L422;Сергиев Посад2;141310, Московская обл, Сергиево-Посадский р-н, Сергиев Посад г, Красной Армии пр-кт, дом № 171;Ср-Вс (09:00-19:00);56,316107;38,136709
GA94;ЕК Победы;620042, Свердловская обл, Екатеринбург г, Победы ул, дом № 96;Пн-Вс (09:00-21:00);56,903558;60,588116
GM54;РнД Горизонт;"344000, Ростовская обл, Ростов-на-Дону г, Михаила Нагибина пр-кт, дом № 32 Ж ТЦ Горизонт, 1-ый этаж, возле кинотеатра ""КиноМакс""";Пн-Вс (10:00-22:00);47,259405;39,719957
YP29;СПб Василеостровская;190000, Санкт-Петербург г, Средний ВО пр-кт, дом № 28/29, литера А, помещение 23-Н;Пн-Вс (09:00-21:00);59,943026;30,279306
YR28;СПб ОКЕЙ Озерки;194356, Санкт-Петербург г, Выборгское ш, дом № 3, корпус 1;Пн-Вс (10:00-21:00);60,038319;30,320823
YR25;СПб ОКЕЙ Космонавтов;196233, Санкт-Петербург г, Космонавтов пр-кт, дом № 45, литера А;Пн-Вс (10:00-21:00);59,851445;30,350138
YR23;СПб ОКЕЙ Жукова;198332, Санкт-Петербург г, Маршала Жукова пр-кт, дом № 31, корпус 1;Пн-Вс (10:00-21:00);59,858528;30,228573
L286;Климовск;142180, Московская обл, Климовск г, 50- летия Октября пр-кт, дом № 7;Пн-Вс (09:00-19:00);55,379658;37,542405
LB42;РТ Набережные Челны4;"423800, Татарстан Респ, Набережные Челны г, им Вахитова пр-кт, остановка ""Глобус""";Пн-Вс (09:00-21:00);55,745614;52,424284
LA37;РТ Бугульма;423230, Татарстан Респ, Бугульминский р-н, Бугульма г, Газинура Гафиатуллина ул, дом № 47А;Пн-Вс (09:00-20:00);54,536413;52,789489
GD89;Члб Сталеваров;454038, Челябинская обл, Челябинск г, Сталеваров ул, дом № 66;Вт-Чт (10:00-18:00), Сб-Вс (10:00-18:00);55,251678;61,402379
L282;Истра2;143500, Московская обл, Истринский р-н, Истра г, Урицкого пл, дом № 1А ТК;Пн-Вс (09:00-21:00);55,91407;36,862274
GN99;Крнд Стасова;350000, Краснодарский край, Краснодар г, Ставропольская ул, дом № 189/1;Пн-Вс (09:00-20:00);45,017087;39,04184
GD19;Члб Гагарина;454010, Челябинская обл, Челябинск г, Гагарина ул, дом № 16;Пн-Вс (10:00-20:00);55,139689;61,439593
LD34;МРД Саранск3;"430000, Мордовия Респ, Саранск г, Косарева ул, Территория северо-восточного рынка, павильон ""Хозтовары"" №17 рынок Заречье,";Пн-Вс (09:00-20:00);54,197431;45,243559
GN57;Крнд Лоо;354208, Краснодарский край, Сочи г, Лазаревский р-н, Лоо п, Декабристов ул, дом № 20ж;Пн-Вс (08:00-18:00);43,688217;39,594558
GB46;Крг Шадринск;641870, Курганская обл, Шадринск г, Свердлова ул, дом № 62;Пн-Вт (10:00-18:00), Чт-Пт (10:00-18:00), Вс (10:00-18:00);56,085438;63,619389
LR20;Кмр Арго;650025, Кемеровская обл, Кемерово г, Кузнецкий пр-кт, дом № 79;Пн-Вс (09:00-21:00);55,344251;86,059835
GO18;Крнд Геленджик;353460, Краснодарский край, Геленджик г, Островского ул, дом № 15;Пн-Вс (09:00-21:00);44,561217;38,080297
YP60;СПб Зеленогорск;197720, Санкт-Петербург г, Зеленогорск г, Ленина пр-кт, дом № 17 Б, литера А;Пн-Вс (09:00-21:00);60,197985;29,706172
YB24;Кинешма;155800, Ивановская обл, Кинешемский р-н, Кинешма г, Рылеевская ул, дом № 3;Пн-Вс (09:00-19:00);57,443223;42,16905
LC96;РТ Чебоксары Мега Молл;428000, Чувашская Респ, Чебоксары г, Калинина ул, дом № 105А;Пн-Сб (10:00-21:00), Вс (10:00-20:00);56,137687;47,277987
GC34;Тмн Тобольск;626150, Тюменская обл, Тобольск г, 4-й мкр, дом № 57/2;Пн (09:00-17:00), Ср-Чт (09:00-17:00), Сб-Вс (09:00-17:00);58,218652;68,277185
GB84;Пермь Молодежная;614000, Пермский край, Пермь г, Первомайская ул мкр-он Молодежный, дом № 10;Пн-Вс (10:00-20:00);58,114949;56,366954
LB83;РТ Савиново;421001, Татарстан Респ, Казань г, Ямашева пр-кт, дом № 93;Пн-Вс (10:00-21:00);55,826073;49,148825
GN44;Ствр Кисловодск;357700, Ставропольский край, Кисловодск г, Горького ул, дом № 26/ ул. 40 лет Октября 13/ ул. А. Губина 1а;Пн-Вс (08:00-20:00);43,909551;42,707912
GL23;Астр Исады;"414000, Астраханская обл, Астрахань г, Наташи Качуевской ул./Свердлова ул./Ногина ул, дом № 27/96/4, литер строения ""Г""";Пн-Вс (08:00-20:00);46,352937;48,038283
LQ57;Ирк Байкальская;664046, Иркутская обл, Иркутск г, Байкальская ул, ост. Волжская подземный переход, правая сторона;Пн-Вс (10:00-20:00);52,263166;104,31349
LE56;СРТ Энгельс3;413111, Саратовская обл, Энгельс г, Строителей пр-кт, дом № 2;Пн-Вс (09:00-21:00);51,48002;46,128044
YS27;СПб Южный полюс;192241, Санкт-Петербург г, Пражская ул, дом № 48/50, литера А ТЦ Южный Полюс;Пн-Вс (10:00-22:00);59,863867;30,403371
GA45;ЕК Карнавал;620034, Свердловская обл, Екатеринбург г, Халтурина ул, дом № 55;Пн-Вс (10:00-22:00);56,853121;60,550471
YP23;СПб Ашан-Парнас;188640, Ленинградская обл, Всеволожский р-н, западнее пос. Бугры, пересечение КАД (кольцевой дороги) и автодороги Санкт-Петербург - Скотное Пересечение КАД и пр-та Энгельса, ТЦ Ашан Парнас;Пн-Вс (09:00-20:00);60,092623;30,381546
LR23;Кмр Лапландия;650023, Кемеровская обл, Кемерово г, Октябрьский пр-кт, дом № 34;Пн-Вс (10:00-21:00);55,350397;86,133617
LA28;РТ Баймак - Салавата Юлаева;453631, Башкортостан Респ, Баймакский р-н, Баймак г, Салавата Юлаева ул, дом № 17;Пн-Вс (09:00-20:00);52,59475;58,303222
LQ94;Ирк Тулун;665268, Иркутская обл, Тулун г, Ленина ул, дом № 96а;Пн-Вс (09:00-21:00);54,55712;100,578038
YB94;Мценск;303030, Орловская обл, Мценск г, Мира ул, дом № 36;Пн-Вс (09:00-20:00);53,279518;36,57343
GA39;ЕК Каменск-Уральский3;623408, Свердловская обл, Каменск-Уральский г, Суворова ул, дом № 24;Пн-Вс (10:00-21:00);56,390757;61,929403
GB75;Пермь Кудымкар;619000, Пермский край, Кудымкар г, Данилова ул, дом № 13в;Пн-Вс (09:00-19:00);59,016795;54,657176
L408;Раменское4;"140108, Московская обл, Раменский р-н, Раменское г, Ногина ул, у магазина ""Россияне""";Пн-Вс (10:00-21:00);55,567173;38,225148
YP35;СПб Всеволожск 2;188643, Ленинградская обл, Всеволожский р-н, Всеволожск г, Всеволожский пр-кт, дом № 72;Пн-Пт (11:00-17:00);60,014763;30,647276
LA24;РТ Альметьевск - Панорама;423450, Татарстан Респ, Альметьевский р-н, Альметьевск г, Ленина ул, дом № 100;Пн-Вс (10:00-22:00);54,899325;52,273924
GD96;Члб Троицк2;457100, Челябинская обл, Троицкий р-н, Троицк г, Гагарина ул, дом № 39;Пн-Вс (09:00-21:00);54,08853;61,558274
L233;Воскресенск;140200, Московская обл, Воскресенский р-н, Воскресенск г, Ленина пл, дом № 5;Пн-Вс (10:00-22:00);55,321627;38,672868
L384;Павловский Посад2;142500, Московская обл, Павлово-Посадский р-н, Павловский Посад г, Революции пл, дом № 7;Пн-Ср (09:00-18:00), Пт (09:00-18:00), Вс (09:00-18:00);55,780809;38,652217
GL62;Влд ТКРеал;"400000, Волгоградская обл, Волгоград г, Историческая ул, дом № 175 ООО ТРК ""Реал-гипермаркет""";Пн-Вс (09:00-22:00);48,756119;44,478213
LR22;Кмр Кесало;650903, Кемеровская обл, Кемерово г, Ленина ул, юго-восточнее дома №135;Пн-Вт (09:00-19:00), Чт-Сб (09:00-19:00);55,347956;86,160103
YR31;СПб ОКЕЙ Просвещения;195297, Санкт-Петербург г, Просвещения пр-кт, дом № 80, корпус 2, литера А;Пн-Вс (10:00-21:00);60,039093;30,409846
LC48;РТ Ульяновск - Дарс;432072, Ульяновская обл, Ульяновск г, Ульяновский пр-кт, дом № 1 Заволжский район;Пн-Вс (10:00-21:00);54,369196;48,587101
LQ64;Ирк Братск 2;665709, Иркутская обл, Братск г, Энергетик жилрайон, Пирогова ул, на существующей остановочной площадке, северо-восточнее дома №10 северо-восточнее дома № 10;Пн-Вс (09:00-19:00);56,311193;101,750984
YC81;Смоленск4;214000, Смоленская обл, Смоленск г, Гагарина пр-кт, дом № 1 ТЦ Юнона,1 этаж;Пн-Вс (10:00-20:00);54,777284;32,050389
YB66;Ливны;303850, Орловская обл, Ливны г, М.Горького ул, дом № 7;Пн-Вс (09:00-19:00);52,427099;37,605731
LR07;Ирк Усть-Илимск 1;"666681, Иркутская обл, Усть-Илимск г, Мечтателей ул, р-н кинотеатра ""Яросама""";Пн-Вс (09:00-21:00);57,943039;102,741523
GL49;Влд Михайловка;403343, Волгоградская обл, Михайловка г, Обороны ул, дом № 44;Пн-Вс (09:00-19:00);50,071546;43,234239
LQ91;Ирк Тайшет;665008, Иркутская обл, Тайшет г, Транспортная ул, 22 метра на юго-восток от дома №11 22 метра на юго-восток от дома № 11;Пн-Вс (09:00-19:00);55,937546;98,010662
L241;Дзержинский;140090, Московская обл, Дзержинский г, Лесная ул, дом № 1;Пн-Вт (09:00-19:00), Пт-Вс (09:00-19:00);55,630742;37,854005
