partnerCode;shopName;shopAddress;workingHours;latitude;longitude
YA55;Воронеж26;"394004, Воронежская обл, Воронеж г, Ленинский пр-кт, дом № 116 с Остановочный комплекс ""Придача""";Пн-Вс (09:00-20:00);51,671739;39,252606
YC37;Петушки;601144, Владимирская обл, Петушинский р-н, Петушки г, Маяковского ул, дом № 12а;Пн-Вс (09:00-19:00);55,93598;39,458382
YD39;Унеча;243300, Брянская обл, Унечский р-н, Унеча г, Иванова ул, дом № 10;Пн-Вс (09:00-19:00);52,842512;32,675886
YA18;Белгород9;308010, Белгородская обл, Белгород г, Б.Хмельницкого пр-кт, дом № 164 ТЦ РИО;Пн-Вс (10:00-21:00);50,642103;36,572131
YC50;Россошь;396659, Воронежская обл, Россошанский р-н, Россошь г, Октябрьская пл, дом № 22б;Пн-Вс (08:00-19:00);50,198806;39,53906
R227;Судогда2 ЕС;601350, Судогда г, Ленина ул 42;Пн-Пт (09:00-18:00);55,95122;40,8626
LD18;Кир Слободской3;613150, Кировская обл, Слободской р-н, Слободской г, Советская ул, дом № 79;Пн-Сб (09:00-20:00), Вс (09:00-19:00);58,730253;50,183053
U569;ЕК Шаля2 ЕС;623030, Шаля пгт, Орджоникидзе ул, д. 2б;Пн-Вс (09:00-20:00);57,25197;58,72426
X621;Якутск Дворец Связи ЕС;677000, Якутск г, Ленина пр-кт 7;Пн-Вс (09:00-21:00);62,03249;129,74441
L161;ТЦ Калита;117418, Москва г, Новоясеневский пр-кт, дом № 7 ТЦ Калита;Пн-Вс (10:00-22:00);55,607489;37,532397
LP32;Прим Владивосток ТЦ Дружба;690039, Приморский край, Владивосток г, Русская ул, дом № 2 А ТЦ Дружба;Пн-Вс (10:00-20:00);43,165384;131,90647
N053;Крск ТЦ Планета2 ЕС;660125, Красноярск г, 9 Мая 77;Пн-Вс (10:00-22:00);56,0509;92,90438
YD80;Россошь3;396658, Воронежская обл, Россошанский р-н, Россошь г, Труда пр-кт, дом № 4Б;Пн-Вс (09:00-20:00);50,197287;50,197287
L449;Тучково;143130, Московская обл, Рузский р-н, Тучково рп, Привокзальная площадь ул, дом № 9;Пн-Вс (09:00-20:00);55,631;36,556734
GL24;Астр Исады2;414000, Астраханская обл, Астрахань г, ул.Красная Набережная/Ногина д98/1, Литер А ,помещение 2;Пн-Вс (08:00-19:00);46,347459;48,056524
X402;Амур Благовещенск Октября3 ЕС;675000, Благовещенск г, 50 лет Октября ул 42;Пн-Вс (09:00-20:00);50,26711;127,53505
R732;Рязань ТРЦ Премьер ЕС;390000, Рязань г, Московское ш 21;Пн-Вс (10:00-22:00);54,63437;39,6888
N812;КО Прокопьевск Гагарина ЕС;653033, Прокопьевск г, Гагарина ул 35;Пн (09:00-19:00), Ср-Пт (09:00-19:00), Вс (09:00-19:00);53,87169;86,64674
NE95;Ирк Шелехов ТЦ Радуга ЕС;г.Шелехов, Квартал 6, дом 30 А;Пн-Вс (09:00-20:00);52,209045;104,092526
R078;Ржев4 ЕС;172390, Ржев г, Ленина ул 18;Пн-Вс (09:00-21:00);56,26668;34,32985
YO66;Вновг Старая Русса;175202, Новгородская обл, Старорусский р-н, Старая Русса г, Поперечная ул, дом № 73;Пн-Вс (09:00-20:00);57,994969;31,345405
GN98;Крнд Старощербиновская;353620, Краснодарский край, Щербиновский р-н, Старощербиновская ст-ца, Первомайская ул, дом № 84;Пн-Вс (08:00-19:00);46,632882;38,65987
RH08;Задонск ТЦ Сити Молл ЕС;399201, Задонск г, Крупской ул 55;Пн-Вс (09:00-19:00);52,38612;38,92274
X633;Якутия Ытык-Кюёль ЕС;678650, Ытык-Кюель с, Мординова ул 22;Пн-Пт (10:00-18:00);62,36019;133,56359
S274;Псков Коммунальная2 ЕС;180024, Псков г, Коммунальная ул 41;Пн-Вс (10:00-21:00);57,82044;28,29088
X638;Якутия Чурапча1 ЕС;678670, Чурапча с, К. Маркса ул 15;Пн-Сб (09:00-19:00);61,99851;132,43918
LE36;СРТ Красный Кут;413235, Саратовская обл, Краснокутский р-н, Красный Кут г, Саратовский пер, дом № 1;Пн-Вс (08:00-18:00);50,949714;46,971469
U834;ЕК Тавда2 ЕС;623950, Тавда г, 9-Мая ул 4 пом 53;Пн-Вс (10:00-18:00);58,04623;65,27372
U685;Пермь Чердынь ЕС;618601, Чердынь г, Успенская ул, 74;Пн-Пт (10:00-18:00);60,40237;56,48063
S827;Мрмск Оленегорск Ленинградский ЕС;184530, Оленегорск г, пр.Ленинградский 7;Пн-Пт (10:00-18:00);68,13856;33,28153
ND42;Тыва Кызыл Добровольцев3 ЕС;667000, Кызыл г, Тувинских добровольцев ул 26;Пн-Вс (09:00-20:00);51,71716;94,44178
GC56;ХМАО Когалым ТЦ Галактика;628481, Ханты-Мансийский Автономный округ - Югра АО, Когалым г, Дружбы Народов ул, дом № 60 ТЦ Галактика;Пн-Вс (10:00-22:00);62,258422;74,542493
LQ47;Ирк ТЦ Карамель;664007, Иркутская обл, Иркутск г, Партизанская ул, дом № 36;Пн-Вс (10:00-22:00);52,279297;104,302576
LR95;Крск Железногорск;662970, Красноярский край, Железногорск г, Ленинградский пр-кт, дом № 1б;Пн-Вс (10:00-20:00);56,23039;93,547893
LR68;КО Промышленная;652380, Кемеровская обл, Промышленновский р-н, Промышленная пгт, Н.Островского ул, дом № 20;Ср-Вс (09:00-19:00);54,905457;85,636109
L377;Одинцово9;143005, Московская обл, Одинцовский р-н, Одинцово г, Можайское ш, дом № 71;Пн-Вс (10:00-20:00);55,677951;37,281157
LQ72;Ирк Депутатская;664047, Иркутская обл, Иркутск г, Депутатская ул, остановка 1-я Советская;Пн-Вс (10:00-20:00);52,277971;104,318168
BK03;Крнд Новороссийск Бирюзов ЕС;353900, Новороссийск г, ул. Советов / ул. Бирюзов д.11 / д.;Пн-Вс (09:00-19:00);44,72271;37,76931
LP19;Амур Благовещенск Октября2;675000, Амурская обл, Благовещенск г, 50 лет Октября ул, дом № 44;Пн-Вт (09:00-19:00), Пт-Вс (09:00-19:00);50,267843;127,53578
YO43;Архск Нарьян-Мар3;166000, Ненецкий АО, Архангельская область, Нарьян-Мар г, им В.И.Ленина ул, дом № 42;Пн-Вс (10:00-21:00);67,636403;52,98641
K748;Крнд Славянск-на-Кубани Ковтюха ЕС;353560, Славянск-на-Кубани г, Ковтюха ул 17;Пн-Вс (08:00-18:00);45,26017;38,12585
K592;РД Каспийск Назарова ЕС;368305, Каспийск г, Назарова ул 1;Пн-Вс (09:00-20:00);42,88698;47,6348
MV91;Железнодорожный ТЦ Эдельвейс ЕС;143980, Железнодорожный г, Советская ул 9;Пн-Вс (10:00-21:00);55,75158;38,01209
YB53;Курск18;305044, Курская обл, Курск г, Союзная ул, дом № 16 Б;Пн-Вс (09:00-21:00);51,74717;36,2449
LQ89;Ирк Свирск;665420, Иркутская обл, Свирск г, Комсомольская ул, дом № 2-2;Пн-Вс (10:00-20:00);53,066721;103,341951
LB09;РТ Канаш Рынок;429330, Чувашская Республика - Чувашия, Канаш г, Московская ул, дом № 14, помещение 2;Пн-Вс (08:00-19:00);55,509;47,494502
LT25;Збк Петровск;673005, Забайкальский край, Петровск-Забайкальский р-н, Петровск-Забайкальский г, Ленина ул, дом № 3;Пн-Вс (09:00-19:00);51,252927;108,825818
LP83;Амур Свободный Ленина;676450, Амурская обл, Свободный г, Ленина ул, дом № 72;Вт-Чт (09:00-19:00), Сб-Вс (09:00-19:00);51,378105;128,135893
LP80;Амур Прогресс Центр;676790, Амурская обл, Прогресс пос., Ленинградская ул, дом № 33;Пн-Чт (09:00-18:00), Сб (09:00-18:00);49,74363;129,67641
GB12;ЕК Серов2;"624992, Свердловская обл, Серов г, Ленина ул, дом № 128 ТЦ ""Тайга""";Пн-Вс (09:00-20:00);59,604721;60,570755
GD78;Члб Озерск;456783, Челябинская обл, Озерск г, Космонавтов ул, дом № 15;Пн-Вс (10:00-20:00);55,771255;60,717498
GD15;Члб Башня;454071, Челябинская обл, Челябинск г, Салютная ул, дом № 27;Пн-Вс (10:00-21:00);55,169793;61,443714
YP76;СПб Колпино ТК Ока;196655, Санкт-Петербург г, Колпино г, Октябрьская ул, дом № 8;Пн-Вс (10:00-21:00);59,738991;30,622871
LA22;РТ Алатырь Fugi Film;429826, Чувашская Респ, Алатырь г, Комиссариатская ул, дом № 42  помещение 2;Пн-Пт (09:00-18:00);54,840284;46,590748
GM28;КЧР Черкесск ТЦ Панорама;369000, Карачаево-Черкесская Респ, Черкесск г, Кавказская ул, дом № 37 ТЦ Панорама;Пн-Вс (10:00-21:00);44,231637;42,058659
GC32;Тмн Стар Сити Мол;625007, Тюменская обл, Тюмень г, Тобольский тракт ТЦ стар Сити Молл;Пн-Вс (10:00-22:00);56,834608;60,682455
GN56;Ствр Пятигорск Кирова;357500, Ставропольский край, Пятигорск г, Кирова пр-кт, дом № 36/ ул. Дзержинского, 42;Пн-Чт (09:00-19:00), Вс (09:00-19:00);44,036596;43,074902
GB76;Пермь Кудымкар2;619000, Пермский край, Кудымкар г, Лихачева ул, дом № 55 В павильон;Пн-Вс (09:00-19:00);59,015696;54,66332
LB73;РТ Орск - ДК Нефтехимиков2;462404, Оренбургская обл, Орск г, Ленина пр-кт, дом № 43;Пн-Ср (10:00-18:00), Пт-Сб (10:00-18:00);51,203617;58,56723
LS44;НСиб Голден Парк;630129, Новосибирская обл, Новосибирск г, Курчатова ул, дом № 1 ТЦ Голден Парк;Пн-Вс (10:00-21:00);55,104251;82,960715
ML54;ТЦ Ново-Переделкино ЕС;119634, Москва г, Боровское шоссе 51стр.1;Пн-Вс (09:00-21:00);55,6366;37,35223
RH51;Орел ТЦ Атолл ЕС;302028, Орел г, Октябрьская ул 27;Пн-Вс (10:00-21:00);52,97232;36,05395
X630;Якутия Борогонцы1 ЕС;678350, Борогонцы с, Ленина 38;Пн-Пт (10:00-17:30);62,6713;131,15902
P693;СРТ Аткарск3 ЕС;412420, Аткарск г, Гагарина 101А;Пн-Вс (08:00-20:00);51,87046;44,99509
U843;ЕК Красноуфимск2 ЕС;623300, Красноуфимск г, Рогозинниковых ул 35;Пн-Вс (09:00-19:00);56,61604;57,77255
LR82;Крск Алпи Тельмана;660111, Красноярский край, Красноярск г, Тельмана ул, дом № 30, корпус Г;Пн-Вс (10:00-20:00);56,05346;92,972064
GB87;Пермь Очер;617141, Пермский край, Очерский р-н, Очер г, Ленина ул, дом № 46/14;Пн-Вс (09:00-19:00);57,884994;54,715906
LP24;Якутия Верхневилюйск;678230, Саха /Якутия/ Респ, Верхневилюйский у, Верхневилюйск с, Карла Маркса ул, дом № 21 Б;Пн-Вс (09:00-19:00);63,44865;120,323422
L155;ТЦ Город2;109052, Москва г, Рязанский пр-кт, дом № 2, корпус 2;Пн-Вс (10:00-22:00);55,729836;37,73101
N257;Нсиб Станиславского ЕС;630054, Новосибирск г, Станиславского пл 17;Пн (10:00-20:00), Чт-Вс (10:00-20:00);54,98191;82,87296
N054;Крск ТЦ Планета3 ЕС;660125, Красноярск г, 9 Мая 77;Пн-Вс (10:00-22:00);56,0509;92,90438
YO87;Карел ТРК Лотос Плаза;185014, Карелия Респ, Петрозаводск г, Лесной пр-кт, дом № 47а ТРК Лотос Плаза;Пн-Вс (10:00-22:00);61,77615;34,308473
S624;Калин Балтийск Нептун ЕС;238520, Балтийск г, Ленина пр-кт 65;Пн-Вс (09:00-20:00);54,65453;19,9107
UR65;Пермь Кизел2 ЕС;618350, Пермский край., Кизел г, Советсткая ул, д.28;Пн-Вс (09:30-19:00);59,048717;57,655312
S974;СПб Приозерск Ленина ЕС;188760, Приозерск г, Ленина ул 30;Пн-Вс (09:00-21:00);61,03851;30,1231
RH66;Курск ТРЦ МегаГрин ЕС;305029, Курск г, К.Маркса ул 68;Пн-Вс (10:00-22:00);51,76213;36,18455
L518;ТЦ Золотой Вавилон Отрадное;127562, Москва г, Декабристов ул, дом № 12 ТЦ Золотой Вавилон;Пн-Вс (10:00-22:00);55,86771;37,593699
LT51;Бур Улан-Удэ Туполева2;670050, Бурятия Респ, Улан-Удэ г, Туполева ул, дом № 9;Вт-Ср (10:00-20:00), Пт-Вс (10:00-20:00);51,864651;107,744016
ND14;Хкс Черногорск Юбилейная2 ЕС;655158, Черногорск г, Юбилейная ул 24 А;Пн (10:00-20:00), Чт-Вс (10:00-20:00);53,8282;91,3347
L545;Электрозаводская ТЦ Заря;107023, Москва г, Семеновская Б ул, дом № 20 ТЦ Заря;Пн-Вс (09:00-22:00);55,781623;37,705333
GA86;ЕК ОКЕЙ Бабушкина;620017, Свердловская обл, Екатеринбург г, Бабушкина ул, дом № 2 ТЦ ОКЕЙ;Пн-Вс (10:00-20:00);56,882047;60,630523
GC22;Тмн ОКЕЙ;625000, Тюменская обл, Тюмень г, Широтная ул, дом № 199 ТЦ О'КЕЙ;Пн-Вс (10:00-22:00);57,096457;65,624744
GA48;ЕК Качканар2;624351, Свердловская обл, Качканар г, Свердлова ул, дом № 7 г;Пн-Вс (10:00-19:00);58,704551;59,479138
GN90;Крнд Сочи Море Молл;354068, Краснодарский край, Сочи г, Новая Заря ул, дом № 7;Пн-Вс (10:00-22:00);43,605987;39,73256
GM29;КЧР Черкесск ТЦ Россия;369000, Карачаево-Черкесская Респ, Черкесск г, Ленина пр-кт, дом № 25;Пн-Вс (10:00-21:00);44,224252;42,047278
S643;Карел Кемь ЕС;186615, Кемь г, пр. Пролетарский 41;Пн-Вс (09:00-20:00);64,95481;34,59473
P451;РТ Стерлитамак ТЦ Фабри2 ЕС;453117, Стерлитамак г, Худайбердина ул 120;Пн-Вс (10:00-22:00);53,62821;55,94014
GL91;Крнд Адлер ТЦ Новый век2;354340, Краснодарский край, Сочи г, Демократическая ул, дом № 52 ТЦ Новый Век;Пн-Вс (10:00-21:00);43,426449;39,927617
GM66;РнД Золотой Вавилон;344000, Ростовская обл, Ростов-на-Дону г, Малиновского ул, дом № 25;Пн-Вс (10:00-22:00);47,230727;39,610553
YB55;Курск27;305000, Курская обл, Курск г, Дружбы пр-кт, дом № 9а;Пн-Вс (09:00-21:00);51,742475;36,133532
GB06;ЕК Ревда3;623280, Свердловская обл, Ревда г, Цветников ул, дом № 39 А ТЦ Квартал;Пн-Вс (10:00-20:00);56,796917;59,916354
YC41;Покров2;601122, Владимирская обл, Петушинский р-н, Покров г, Ленина ул, дом № 47;Пн-Вс (09:00-19:00);55,918422;39,183582
YB57;Курск31;305040, Курская обл, Курск г, Студенческая ул, дом № 1;Пн-Вс (10:00-22:00);51,741726;36,145697
YO86;Карел Сортавала;186790, Карелия Респ, Сортавала г, Кирова ул, дом № 6;Пн-Вс (09:00-20:00);61,702553;30,694039
L087;Павелецкая4;115054, Москва г, Павелецкая пл, дом № 2 стр 3;Пн-Вс (09:00-22:00);55,730424;37,634836
LZ33;Якутия Сунтар;678290, Саха /Якутия/ Респ, Сунтарский у, Сунтар с, Октябрьская ул, дом № 57,корпус 2;Пн-Сб (09:00-18:00);62,157292;117,650025
SD07;Вновг Боровичи Коммунарная ЕС;174411, Боровичи г, Коммунарная ул 51;Пн-Вс (09:00-19:00);58,38972;33,91072
GO76;Адг Адыгейск;385200, Адыгея Респ, Адыгейск г, Ленина ул, дом № 2, корпус В;Пн-Вс (08:00-20:00);44,8793;39,1865
K104;Крнд Геленджик Островского2 ЕС;353460, Геленджик г, Островского ул 15;Пн-Вс (09:00-19:00);44,56128;38,08033
MV78;ТРЦ Европейский3 ЕС;121059, Москва г, Киевского вокзала пл 2;Пн-Чт (10:00-22:00), Пт-Сб (10:00-23:00), Вс (10:00-22:00);55,74463;37,56607
L194;Фрунзенская;119146, Москва г, Комсомольский пр-кт, дом № 24, строение 1;Пн-Вс (10:00-22:00);55,727984;37,580585
LP36;Хаб Вяземский вокзал;682950, Хабаровский край, Вяземский р-н, Вяземский г, Коммунистическая ул, дом № 3в;Пн-Вс (09:00-20:00);47,536214;134,75393
LT20;Збк Агинское2;687000, Забайкальский край, Агинский р-н, Агинское пгт, Ленина ул, дом № 62;Пн-Вс (09:00-20:00);51,106684;114,54503
GE03;Члб Фокус;454021, Челябинская обл, Челябинск г, Молдавская ул, дом № 16 ТЦ;Пн-Вс (10:00-22:00);55,19079;61,302837
GD68;Члб Миасс5;456300, Челябинская обл, Миасс г, Автозаводцев пр-кт, дом № 65 ТРК Слон;Пн-Вс (10:00-21:00);55,046505;60,110025
LD05;РТ Шумерля Ленина;429120, Чувашская Респ, Шумерля г, Ленина ул, дом № 6;Пн-Вс (09:00-18:00);55,498989;46,413855
GD38;Члб Киномакс2;454091, Челябинская обл, Челябинск г, Воровского ул, дом № 6 ТЦ Урал;Пн-Вс (10:00-22:00);55,157513;61,394768
L238;Голицыно3;143040, Московская обл, Одинцовский р-н, Голицыно г, Звенигородское ш, дом № 2 а строение 1;Пн-Вс (09:00-21:00);55,610802;37,003261
GL80;КБР Прохладный2;361045, Кабардино-Балкарская Респ, Прохладненский р-н, Прохладный г, Пролетарская ул, дом № 58;Пн (08:00-18:00), Ср (08:00-18:00), Пт-Вс (08:00-18:00);43,762818;44,006576
YC32;Острогожск2;397853, Воронежская обл, Острогожский р-н, Острогожск г, Крамского ул, дом № 1;Пн-Вс (08:00-18:00);50,859618;39,079006
R754;Новомосковск ТРЦ Первый ЕС;301664, Новомосковск г, Трудовые резервы ул 33Б;Пн-Вс (10:00-21:00);54,01601;38,28619
LQ33;Бур Улан-Удэ Эрдем2;670000, Бурятия Респ, Улан-Удэ г, Ленина ул, дом № 27;Пн-Вс (10:00-20:00);51,827244;107,583839
S828;Мрмск Кола ЕС;184381, Кола г, пр.Советский 40;Пн-Пт (10:00-19:00);68,87988;33,02279
LA64;РТ Елабуга Нефтяников;423600, Татарстан Респ, Елабужский р-н, Елабуга г, Нефтяников пр-кт, дом № 17;Пн-Вс (09:00-19:00);55,751704;52,015978
LT09;Тыва Кызыл Тувинская;667000, Тыва Респ, Кызыл г, Тувинских Добровольцев ул, дом № 19;Пн-Вс (09:00-21:00);51,719085;94,441869
GD05;ХМАО Ханты-Мансийск3;628001, Ханты-Мансийский Автономный округ - Югра АО, Ханты-Мансийск г, Заводская ул, дом № 24 ТЦ Меридиан;Пн-Вс (09:00-19:40);60,96705;69,039224
YO20;СКТ ТЦ Июнь;167000, Коми Респ, Сыктывкар г, Октябрьский пр-кт, дом № 131/3 ТЦ Июнь;Пн-Вс (10:00-22:00);61,690613;50,803182
YP58;СПб Заневский каскад3;195112, Санкт-Петербург г, Заневский пр-кт, дом № 67, корпус 2, литера В ТК Заневский Каскад;Пн-Вс (10:00-21:00);59,932924;30,437674
LS84;Омск ОКЕЙ;644000, Омская обл, Омск г, Энтузиастов ул, дом № 2, корпус 1;Пн-Вс (10:00-21:00);55,048385;73,29149
L332;Люберцы13;140006, Московская обл, Люберецкий р-н, Люберцы г, Октябрьский пр-кт, дом № 366 ТРЦ Орбита;Пн-Вс (10:00-22:00);55,663156;37,910585
GM18;Крнд Усть-Лабинск3;352330, Краснодарский край, Усть-Лабинский р-н, Усть-Лабинск г, Ободовского ул, дом № 27 литер к ул. Ободовского, 27, лит К;Пн-Вс (08:00-20:00);45,21512;39,690795
YA78;Вязьма4;215110, Смоленская обл, Вяземский р-н, Вязьма г, 25 Октября ул, дом № 4;Пн-Вс (09:00-20:00);55,205123;34,298114
GL81;Крнд 40 лет Победы;350072, Краснодарский край, Краснодар г, 40 лет Победы ул, дом № 81;Пн-Вс (09:00-21:00);45,055938;39,022223
R874;Кувшиново ЕС;172110, Тверская область, г. Кувшиново, Октябрьская ул., д. 28Б;Пн-Вт (09:00-19:00), Чт-Сб (09:00-19:00);57,030421;34,172021
GN52;Ствр Новоалександровск;356000, Ставропольский край, Новоалександровский р-н, Новоалександровск г, Маршала Жукова ул, дом № 1;Пн-Вс (08:00-20:00);45,489842;41,20783
YD10;Тверь17;170039, Тверская обл, Тверь г, Паши Савельевой ул, дом № 27, корпус 1;Пн-Вс (09:00-20:00);56,882569;35,841474
MX10;ТЦ Будапешт ЕС;109457, Москва г, Зеленодольская ул 40;Пн-Вс (10:00-22:00);55,70413;37,76576
GL73;КБР Нальчик Галерея;360003, Кабардино-Балкарская Респ, Нальчик г, Кирова ул, дом № 1 Д ТЦ Галерея;Пн-Вс (10:00-21:00);43,476302;43,573843
RE32;Обоянь3 ЕС;306230, Обоянь г, Ленина ул 34;Пн-Вс (09:00-19:00);51,2103;36,26995
P734;ПНЗ Плеханова ЕС;440000, Пенза г, Плеханова ул 19;Пн-Вс (09:00-21:00);53,20027;45,01209
MV44;Домодедово ТЦ Торговый Квартал ЕС;142000, Домодедово г, Каширское шоссе, строение 3А;Пн-Вс (10:00-22:00);55,45178;37,76312
YP64;СПб Каменноостровский проспект;197022, Санкт-Петербург г, Каменноостровский пр-кт, дом № 42, литера А;Пн-Вс (10:00-22:00);59,966729;30,309375
GB50;Крг Щучье;"641010, Курганская обл, Щучанский р-н, Щучье г, Советская ул, между торговым павильоном ""Евросеть"" и зданием №3 по ул.Победы между торговым павильоном ""Евросеть"" и зданием № 3 по пл. Победы";Пн-Чт (09:00-18:00), Вс (09:00-18:00);55,209487;62,751281
GM31;Кчр Черкесск4;369000, Карачаево-Черкесская Респ, Черкесск г, Ленина пр-кт, дом № 73, литера А;Пн-Вс (09:00-21:00);44,218849;42,045899
YC53;Ростов Великий3;152151, Ярославская обл, Ростовский р-н, Ростов г, Советский пер, дом № 3/2, помещение 1-5;Пн (09:00-18:00), Ср-Чт (09:00-18:00), Сб-Вс (09:00-18:00);57,185981;39,416054
UR33;Крг ТЦ РИО ЕС;640003, Курган г, Невежина ул 3;Пн-Вс (10:00-21:00);55,42835;65,29806
GD03;ХМАО Ханты-Мансийск Nebo;628011, Ханты-Мансийский Автономный округ - Югра АО, Ханты-Мансийск г, Мира ул, дом № 45;Пн-Вс (10:00-21:00);61,006441;69,040443
LQ39;Збк Могойтуй;687420, Забайкальский край, Могойтуйский р-н, Могойтуй пгт, Юбилейная ул, дом № 3а;Пн-Вс (09:00-19:00);51,285272;114,927493
