partnerCode;shopName;shopAddress;workingHours;latitude;longitude
LA26;РТ Арск - Советская площадь;422000, Татарстан Респ, Арский р-н, Арск г, Советская пл, дом № 21;Пн-Вс (08:00-19:00);56,090744;49,878856
GO68;Крнд Новороссийск2;353910, Краснодарский край, Новороссийск г, Ленина пр-кт, дом № 4;Пн-Вс (10:00-20:00);44,704529;37,785388
YO13;СКТ Норд Хаус;169711, Коми Респ, Усинск г, Парковая ул, дом № 8Б ТЦ Норд Хаус,1 этаж;Пн-Сб (10:00-20:00), Вс (10:00-18:00);65,990727;57,545231
YO19;СКТ София;168712, Коми Респ, Усинск г, Молодежная ул, дом № 12,2, массив, 14 квартал;Пн-Вс (09:00-19:00);65,989555;57,565632
YA20;Богородицк;301835, Тульская обл, Богородицкий р-н, Богородицк г, Коммунаров ул, дом № 61;Пн-Вс (09:00-20:00);53,771051;38,131198
YO22;СКТ Усинск Нефтяников;169711, Коми Респ, Усинск г, Нефтяников ул, дом № 50;Пн-Вс (09:00-19:00);65,9935;57,560511
YD48;Щекино2;301246, Тульская обл, Щекинский р-н, Щекино г, Юбилейная ул, дом № 19б;Пн-Вс (09:00-20:00);54,02407;37,497956
LE46;СРТ Сити Молл;410039, Саратовская обл, Саратов г, Ново-Астраханское ш, дом № 80 ТЦ Сити Молл;Пн-Вс (09:00-22:00);51,49459;45,920938
LS32;Крск ТЦ Красноярье;660095, Красноярский край, Красноярск г, им газеты Красноярский Рабочий пр-кт, дом № 120 ТЦ Красноярье;Пн-Вс (10:00-20:00);56,004621;92,931292
YP95;СПб Луга 2;188230, Ленинградская обл, Лужский р-н, Луга г, Урицкого пр-кт, дом № 48А, помещение 6-8;Пн-Вс (09:00-19:00);58,740427;29,849241
LZ14;Хабаровск Центральный рынок;680021, Хабаровский край, Центральный район, Хабаровск г, Льва Толстого ул, дом № 22 - Амурский бульвар;Пн-Вс (10:00-20:00);48,488028;135,069137
LQ64;Ирк Братск 2;665709, Иркутская обл, Братск г, Энергетик жилрайон, Пирогова ул, на существующей остановочной площадке, северо-восточнее дома №10 северо-восточнее дома № 10;Пн-Вс (09:00-19:00);56,311193;101,750984
YC81;Смоленск4;214000, Смоленская обл, Смоленск г, Гагарина пр-кт, дом № 1 ТЦ Юнона,1 этаж;Пн-Вс (10:00-21:00);54,777284;32,050389
YB66;Ливны;303850, Орловская обл, Ливны г, М.Горького ул, дом № 7;Пн-Вс (09:00-19:00);52,427099;37,605731
LR07;Ирк Усть-Илимск 1;"666681, Иркутская обл, Усть-Илимск г, Мечтателей ул, р-н кинотеатра ""Яросама""";Пн-Вс (09:00-21:00);57,943039;102,741523
LA70;РТ Зеленодольск - Комарова;422545, Татарстан Респ, Зеленодольский р-н, Зеленодольск г, Комарова ул, примерно 50 м от дома №21 по направлению на север.;Пн-Вс (09:00-20:00);55,856685;48,561835
YB46;Котовск;393194, Тамбовская обл, Котовск г, Колхозная ул, дом № 8;Пн-Вс (08:00-20:00);52,58421;41,498814
GL49;Влд Михайловка;403343, Волгоградская обл, Михайловка г, Обороны ул, дом № 44;Пн-Вс (08:00-20:00);50,071546;43,234239
LR64;КО Полысаево;652560, Кемеровская обл, Полысаево г, Космонавтов ул, дом № 82-15;Пн-Вс (09:00-20:00);54,604997;86,282148
YR66;СПб Сертолово;188650, Ленинградская обл, Всеволожский р-н, Сертолово г, Сосновая ул, дом № 3 А;Пн-Вс (09:00-21:00);60,142362;30,210176
GL82;Крнд Абинск;353320, Краснодарский край, Абинский р-н, Абинск г, Мира ул, дом № 2/10;Пн-Вс (08:00-18:00);44,864868;38,167784
YO29;Архск Архангельск СПб;163020, Архангельская обл, Архангельск г, Никольский пр-кт, дом № 56;Пн-Вс (10:00-20:00);64,576638;40,507801
YO47;Архск Северодвинск СПб;164500, Архангельская обл, Северодвинск г, Карла Маркса ул, дом № 21 ТЦ Никольский посад;Пн-Вс (11:00-19:45);64,558612;39,797152
YO50;Архск Северодвинск2 СПб;164504, Архангельская обл, Северодвинск г, Ломоносова ул, дом № 71А, литер А;Пн-Вс (10:00-20:00);64,553971;39,804717
YD33;Тула8;300062, Тульская обл, Тула г, Октябрьская ул, дом № 95;Пн-Вс (09:00-20:00);54,218563;37,625585
L056;Зеленоград5;124575, Москва г, Зеленоград г, Крюковская пл, дом № 1 ТК Иридиум;Пн-Вс (10:00-22:00);55,982546;37,174989
L147;Тушинская3;125362, Москва г, Тушинская ул, дом № 17;Пн-Вс (09:00-21:00);55,826646;37,446865
LQ91;Ирк Тайшет;665008, Иркутская обл, Тайшет г, Транспортная ул, 22 метра на юго-восток от дома №11 22 метра на юго-восток от дома № 11;Пн-Вс (09:00-21:00);55,937546;98,010662
YS33;Сокол Вологодский;162130, Вологодская обл, Сокольский р-н, Сокол г, Советская ул, дом № 60;Пн-Вс (09:00-21:00);59,462743;40,117205
L241;Дзержинский;140090, Московская обл, Дзержинский г, Лесная ул, дом № 1;Пн-Вс (09:00-20:00);55,630742;37,854005
YB08;Иваново8;153037, Ивановская обл, Иваново г, 8 Марта ул, дом № 32;Пн-Вс (10:00-22:00);57,005306;40,984528
YA48;Владимир7;600031, Владимирская обл, Владимир г, Егорова ул, дом № 8;Пн-Вс (09:00-20:00);56,168846;40,478327
LQ69;Ирк Братск4;665709, Иркутская обл, Братск г, Энергетик жилрайон, Наймушина ул ост ДИ Энергетик ДК Энергетик;Пн-Вс (09:00-19:00);56,302986;101,756408
LR10;Ирк Усть-Кут;666784, Иркутская обл, Усть-Кут г, Кирова ул, дом № 19/а привокзальной площади ст. Лена;Пн-Вс (09:00-21:00);56,780894;105,744762
LD89;НН ТЦ Гагаринский;603009, Нижегородская обл, Нижний Новгород г, Гагарина пр-кт, дом № 105 А ТЦ Гагаринский;Пн-Вс (09:00-21:00);56,235755;43,952655
LA54;РТ Гай - Ленина;462631, Оренбургская обл, Гай г, Ленина ул, дом № 48;Пн-Вс (10:00-20:00);51,675198;58,640656
GO50;Крнд Лабинск;352001, Краснодарский край, Лабинский р-н, Лабинск г, Ленина ул, дом № 160;Пн-Вс (08:00-20:00);44,636196;40,725501
LZ01;Хабаровск Гагарина;680052, Хабаровский край, Хабаровск г, Гагарина ул, дом № 10, помещение I(1-3);Пн-Вс (10:00-20:00);48,457534;135,185269
YO06;СКТ Город Мастеров;167004, Коми Респ, Сыктывкар г, Сысольское ш, дом № 11 ТЦ Мебель Град (бывший Город Мастеров), 1 этаж;Пн-Вс (10:00-21:00);61,653258;50,831156
GL20;Астр Жилгородок;414024, Астраханская обл, Астрахань г, Б.Хмельницкого ул, дом № 34/49;Пн-Вс (08:00-20:00);46,335691;48,022464
YC48;Рославль;216500, Смоленская обл, Рославльский р-н, Рославль г, Советская ул, дом № 78;Пн-Вс (09:00-20:00);53,9483;32,852971
L474;Щелково6;141113, Московская обл, Щелковский р-н, Щелково г, Пролетарский пр-кт, дом № 4, корпус 3;Пн-Вс (10:00-20:00);55,917144;37,997232
YP34;СПб Восстания 1;191036, Санкт-Петербург г, Восстания ул, дом № 1 Лит. Б, пом. 1Н;Пн-Вс (09:00-22:00);59,931901;30,360489
YB81;Людиново;249406, Калужская обл, Людиновский р-н, Людиново г, Ф.Энгельса ул, дом № 16, строение 2;Пн-Вс (08:30-19:30);53,862118;34,444456
GA96;ЕК Полевской2;623380, Свердловская обл, Полевской г, К.Маркса ул, дом № 13;Пн-Вс (09:00-19:00);56,442529;60,164601
L027;Ашан-Сокольники;107140, Москва г, Красносельская Верхн. ул, дом № 3А;Пн-Вс (09:00-22:00);55,785553;37,665418
LQ22;Бур Северобайкальск Ленинградская;671700, Бурятия Респ, Северобайкальск г, Ленинградский пр-кт, дом № 10а;Пн-Вс (09:00-19:00);55,636582;109,335301
GO10;Крнд Белореченск;352630, Краснодарский край, Белореченский р-н, Белореченск г, Ленина ул, дом № 75а;Пн-Вс (08:00-21:00);44,756027;39,875632
GL47;Влд Котово;403805, Волгоградская обл, Котовский р-н, Котово г, рыночная площадь, павильон №20;Пн-Вс (08:00-19:00);50,322058;44,801319
LC67;РТ Уфа Галле;"450000, Башкортостан Респ, Уфа г, Советский р-н, Октября пр-кт, на остановке общественного транспорта ""округ Галле""";Пн-Вс (09:00-21:00);54,746841;55,994689
LR57;КО Нкуз Подкова;654034, Кемеровская обл, Новокузнецк г, Ленина ул, дом № 7;Пн-Вс (09:00-21:00);53,769237;87,186225
GD87;Члб Сити Парк;454007, Челябинская обл, Челябинск г, Артиллерийская ул, дом № 136;Пн-Вс (10:00-22:00);55,16358;61,430365
LS85;Омск Проспект Мира;644029, Омская обл, Омск г, Нефтезаводская ул, дом № 7 пересечение с Мира пр-кт, дом № 68;Пн-Вс (09:00-21:00);55,029451;73,271009
YC21;Орел2;302026, Орловская обл, Орел г, Комсомольская ул, дом № 77;Пн-Вс (09:00-21:00);52,953483;36,061988
LE38;СРТ Московская;410000, Саратовская обл, Саратов г, Московская ул, дом № 59/30;Пн-Вс (09:00-21:00);51,533013;46,037469
GC01;Пермь Центральный рынок2;614068, Пермский край, Пермь г, Космонавтов ш, дом № 6;Пн-Вс (09:00-21:00);58,001964;56,229757
GO43;Крнд Кропоткин;352380, Краснодарский край, Кавказский р-н, Кропоткин г, Красная ул, дом № 226-е;Пн-Вс (09:00-20:00);45,431987;40,550654
GM84;РнД Новочеркасск2;346400, Ростовская обл, Новочеркасск г, Просвещения ул, дом № 112/57;Пн-Вс (09:00-21:00);47,41881;40,093834
GA60;ЕК Купец;620014, Свердловская обл, Екатеринбург г, 8 Марта ул, дом № 46;Пн-Вс (10:00-22:00);56,828355;60,600324
GB27;ЕК УПИ;620000, Свердловская обл, Екатеринбург г, ул. Мира, 23/Малышева, 123;Пн-Вс (10:00-20:00);56,840852;60,653082
YP88;СПб Лесная2;194100, Санкт-Петербург г, Кантемировская ул, участок № 21 (северо-западнее дома №61, корпус 3, литера Д по Лесному пр-ту);Пн-Вс (09:00-21:00);59,984931;30,341983
LS28;Крск Торговый Квартал;660028, Красноярский край, Красноярск г, Телевизорная ул, дом № 1, строение 90;Пн-Вс (10:00-22:00);56,023361;92,80202
LC43;РТ Туймазы Ленина;452750, Башкортостан Респ, Туймазинский р-н, Туймазы г, Ленина пр-кт, дом № 10, офис 82;Пн-Вс (09:00-21:00);54,603305;53,700695
LB78;РТ ПаркХаус;420124, Татарстан Респ, Казань г, Ямашева пр-кт, дом № 46/33;Пн-Вс (09:00-22:00);55,829624;49,118651
LC85;РТ Уфа УМПО;450038, Башкортостан Респ, Уфа г, Первомайская ул, дом № 98;Пн-Вс (09:00-21:00);54,80685;56,111421
YB60;Курск5;305018, Курская обл, Курск г, Кулакова пр-кт, остановка Сеймский Рынок;Пн-Вс (09:00-20:00);51,67473;36,145352
LA62;РТ Димитровград Гагарина;433508, Ульяновская обл, Димитровград г, Гагарина ул, дом № 10;Пн-Вс (08:00-20:00);54,216458;49,623337
YA33;Брянск5;241035, Брянская обл, Брянск г, Медведева ул, дом № 2;Пн-Вс (10:00-20:00);53,311921;34,304382
GE08;Члб Южноуральск;457040, Челябинская обл, Южноуральск г, Мира ул, дом № 44;Пн-Вс (10:00-20:00);54,442216;61,270512
LA31;РТ Белебей Ленина;452006, Башкортостан Респ, Белебеевский р-н, Белебей г, им В.И.Ленина ул, дом № 32;Пн-Вс (09:00-21:00);54,104171;54,11034
GM48;РнД Военвед;344064, Ростовская обл, Ростов-на-Дону г, Таганрогская ул, дом № 151;Пн-Вс (09:00-21:00);47,263212;39,655081
LB33;РТ Набережные Челны Омега;423800, Татарстан Респ, Набережные Челны г, Сююмбике пр-кт, дом № 2/19;Пн-Вс (09:00-21:00);55,730729;52,392429
LD14;Кир Городок;613040, Кировская обл, Кирово-Чепецкий р-н, Кирово-Чепецк г, 60 лет Октября ул, дом № 4/1;Пн-Вс (09:00-20:00);58,531511;50,029128
L196;Час Пик;127543, Москва г, МКАД 87-й км, дом № 8 ТК Час Пик;Пн-Вс (10:00-22:00);55,89869;37,629322
YA34;Брянск6;241029, Брянская обл, Брянск г, Московский пр-кт, дом № 38;Пн-Вс (09:00-20:00);53,216431;34,403902
LB15;РТ Кумертау Карла Маркса;453300, Башкортостан Респ, Кумертау г, Карла Маркса ул, дом № 30, пом.3;Пн-Вс (10:00-21:00);52,756842;55,794808
L364;Ногинск2;142400, Московская обл, Ногинский р-н, Ногинск г, пересечение улиц 3 Интернациональная и Трудовой;Пн-Вс (09:00-21:00);55,854699;38,438561
YA96;Ефремов;301840, Тульская обл, Ефремовский р-н, Ефремов г, Ленина ул, дом № 35 в;Пн-Вс (09:00-20:00);53,145705;38,114987
LB93;РТ Самара ПаркХаус2;443110, Самарская обл, Самара г, Московское ш, дом № 81Б;Пн-Вс (10:00-22:00);53,234707;50,202044
GN79;Крнд Приморск-Ахтарский;353864, Краснодарский край, Приморско-Ахтарский р-н, Приморско-Ахтарск г, Пролетарская ул, дом № 91;Пн-Вс (08:00-18:00);46,046288;38,167767
LS75;Омск Амурская;644052, Омская обл, Омск г, Челюскинцев 4-я ул, дом № 119, помещение 6П;Пн-Вс (09:00-21:00);55,026493;73,413706
YR32;СПб ОКЕЙ Пулковский;196140, Санкт-Петербург г, Пулковское ш, дом № 17 ГМ Окей;Пн-Вс (10:00-20:00);59,827499;30,316229
YR36;СПб ОКЕЙ Электросила;196105, Санкт-Петербург г, Московский пр-кт, дом № 137;Пн-Вс (10:00-22:00);59,881596;30,315588
YR21;СПб ОКЕЙ Большевиков;193231, Санкт-Петербург г, Большевиков пр-кт, дом № 10, корпус 1;Пн-Вс (10:00-22:00);59,912017;30,480284
GN71;ЭЛСТ Элиста1;358009, Калмыкия Респ, Элиста г, А.С.Пушкина ул, дом № 54 а, строение 11;Пн-Вс (08:00-20:00);46,316924;44,267012
GD44;Члб Коркино;456550, Челябинская обл, Коркинский р-н, Коркино г, Ленина ул, дом № 17;Пн-Вс (09:00-20:00);54,893745;61,394429
YR07;СПб Нарвская3;198095, Санкт-Петербург г, Стачек пл, дом № 4, корпус 4 участок 109;Пн-Вс (09:00-20:00);59,900496;30,275882
YR08;СПб Нарвская4;198095, Санкт-Петербург г, Стачек пл, дом № 9, корпус 5, литера А  участок 108;Пн-Вс (09:00-22:00);59,900945;30,273296
LA25;РТ Альметьевск Ленина;423452, Татарстан Респ, Альметьевский р-н, Альметьевск г, Ленина ул, дом № 26, помещение 3;Пн-Вс (09:00-20:00);54,903882;52,302883
L051;Ереван Плаза;115191, Москва г, Тульская Б. ул, дом № 13;Пн-Вс (10:00-22:00);55,70875;37,622091
L400;Пушкино;141207, Московская обл, Пушкинский р-н, Пушкино г, Тургенева ул, дом № 1;Пн-Вс (10:00-20:00);56,013504;37,843063
YP65;СПб КарлаМаркса33;188480, Ленинградская обл, Кингисеппский р-н, Кингисепп г, Карла Маркса пр-кт, дом № 33;Пн-Вс (09:00-21:00);59,370295;28,610652
LB85;РТ Салават Ленина;453262, Башкортостан Респ, Салават г, Ленина ул, дом № 25/9, пом.1;Пн-Вс (09:00-21:00);53,352711;55,923867
LR63;КО Осинники;652811, Кемеровская обл, Осинники г, Победы ул, дом № 23;Пн-Вс (10:00-20:00);53,596769;87,337619
LD44;НН Веденяпина;603016, Нижегородская обл, Нижний Новгород г, Веденяпина ул, дом № 2Б, литер А;Пн-Вс (09:00-21:00);56,239565;43,864117
L440;Ступино3;142802, Московская обл, Ступинский р-н, Ступино г, Андропова ул, дом № 63;Пн-Вс (09:00-20:00);54,887064;38,066956
LC14;РТ Стерлитамак Пирамида;453120, Башкортостан Респ, Стерлитамак г, Ибрагимова ул, торговый павильон рядом с домом 58;Пн-Вс (09:00-21:00);53,622954;55,907203
GO72;ЭЛСТ Элиста2;358000, Калмыкия Респ, Элиста г, В.И.Ленина ул, дом № 222, строение 1;Пн-Вс (08:00-20:00);46,30767;44,255265
GL15;Адг Майкоп1;385000, Адыгея Респ, Майкоп г, ул. Гоголя/ ул. Пролетарская, дом № 38/207;Пн-Вс (08:00-20:00);44,608504;40,109593
LC72;РТ Уфа Иремель;450022, Башкортостан Респ, Уфа г, Менделеева ул, дом № 137, литер А, инвентарный №676 ТРК Иремель;Пн-Вс (10:00-21:00);54,713475;55,993582
L289;Клин2;141600, Московская обл, Клинский р-н, Клин г, Карла Маркса ул, дом № 4 ТЦ Дарья;Пн-Вс (10:00-22:00);56,331854;36,712719
YA52;Воронеж16;394006, Воронежская обл, Воронеж г, 20-летия Октября ул, дом № 90;Пн-Вс (10:00-21:00);51,655935;39,189522
LD42;НН Богородск Котельникова;607600, Нижегородская обл, Богородский р-н, Богородск г, Котельникова ул, дом № 1Б, пом.7;Пн-Вс (08:00-20:00);56,102784;43,517479
YD30;Тула4;300028, Тульская обл, Тула г, Ленина пр-кт, дом № 94;Пн-Вс (09:00-20:00);54,165687;37,58586
YR58;СПб Радуга;196105, Санкт-Петербург г, Космонавтов пр-кт, дом № 14, квартал 4;Пн-Вс (10:00-22:00);59,869271;30,350566
GN35;Ствр Буденновск;356800, Ставропольский край, Буденновский р-н, Буденновск г, Красная ул, дом № 238;Пн-Вс (09:00-21:00);44,782763;44,162221
L399;Протвино;142281, Московская обл, Протвино г, Ленина ул, дом № 22А торговый павильон;Пн-Вс (10:00-21:00);54,874255;37,220428
L151;ТЦ Бауманская;105005, Москва г, Бауманская ул, дом № 32, стр 2 ТЦ Елоховский пассаж;Пн-Вс (10:00-22:00);55,772334;37,677969
LR38;КО Березовский;652420, Кемеровская обл, Березовский г, Ленина пр-кт, дом № 24-61;Пн-Вс (09:00-20:00);55,670427;86,273199
YR71;СПб Сосновый бор1;188544, Ленинградская обл, Сосновый Бор г, 8-й мкр, ост Природа пр-кт Героев, дом 28А;Пн-Вс (09:00-19:00);59,9053;29,080493
YR72;СПб Сосновый бор2;"188542, Ленинградская обл, Сосновый Бор г, Героев пр-кт, дом № 49 А, корпус 1, помещение 3 ТЦ ""Москва""";Пн-Вс (10:00-20:00);59,910494;29,086346
LC09;РТ Сибай Горняков;453833, Башкортостан Респ, Сибай г, Горняков пр-кт, дом № 20;Пн-Вс (10:00-20:00);52,721003;58,668367
LB38;РТ Набережные Челны Торгов. Квартал;423821, Татарстан Респ, Набережные Челны г, Мира пр-кт, дом № 3;Пн-Вс (09:00-22:00);55,724963;52,380897
YP03;Мрмск Полярные Зори42;183025, Мурманская обл, Мурманск г, Полярные Зори ул, дом № 42;Пн-Вс (09:00-21:00);68,965353;33,089959
LS58;НСиб ТЦ Красный проспект;630049, Новосибирская обл, Новосибирск г, Красный пр-кт, дом № 101 ТЦ Роял Парк;Пн-Вс (10:00-22:00);55,055369;82,911515
GO35;Крнд Каневская;353730, Краснодарский край, Каневской р-н, Каневская ст-ца, Ленина ул, дом № 19/1;Пн-Вс (08:00-20:00);43,42536;39,925362
LA33;РТ Белорецк-К.Маркса;453500, Башкортостан Респ, Белорецкий р-н, Белорецк г, Карла Маркса ул, дом № 55;Пн-Вс (09:00-21:00);53,967721;58,410729
YD13;Тверь8;170026, Тверская обл, Тверь г, Горького ул и Благоева ул, дом № 122/2;Пн-Вс (10:00-20:00);56,86871;35,893811
GM33;РнД Азов2;346787, Ростовская обл, Азов г, Мира ул, дом № 24;Пн-Вс (08:00-19:00);47,103338;39,424859
YR18;СПб ОКЕЙ Балканский;192281, Санкт-Петербург г, Малая Балканская ул, дом № 27, литера А ТЦ Окей;Пн-Вс (10:00-20:00);59,82971;30,382998
YR22;СПб ОКЕЙ Выборгский;194017, Санкт-Петербург г, Выборгское ш, дом № 19, корпус 1, литера А ГМ Окей;Пн-Вс (10:00-22:00);60,056513;30,309849
LD84;НН Сергач-Школьная;607500, Нижегородская обл, Сергачский р-н, Сергач г, Школьная ул, дом № 5А/1, строение 2;Пн-Вс (08:00-18:00);55,521387;45,502212
YD55;Ярославль12;150023, Ярославская обл, Ярославль г, Московский пр-кт, дом № 108 ТРК РИО;Пн-Вс (10:00-22:00);57,576868;39,843143
LS14;Крск Назарово;662202, Красноярский край, Назарово г, Арбузова ул, дом № 110 пом. 1;Пн-Вс (09:00-21:00);56,011005;90,417595
L361;Нахабино - 2;143432, Московская обл, Красногорский р-н, Нахабино пгт, Институтская ул, дом № 1А;Пн-Вс (09:00-21:00);55,841468;37,182258
YP32;СПб Волхов;187406, Ленинградская обл, Волховский р-н, Волхов г, Молодежная ул, дом № 8;Пн-Вс (09:00-20:00);59,897171;32,352666
LA35;РТ Благовещенск Седова;453431, Башкортостан Респ, Благовещенский р-н, Благовещенск г, Седова ул, дом № 111, пом./секци 22 пом/секция оф. 22;Пн-Вс (09:00-21:00);55,04809;55,955824
L287;Климовск-2;142180, Московская обл, Климовск г, Ленина ул, перед жилым домом № 16;Пн-Вс (09:00-21:00);55,360221;37,52068
