partnerCode;shopName;shopAddress;workingHours;latitude;longitude
GA36;ЕК Ирбит2;623856, Свердловская обл, Ирбит г, 50 лет Октября ул, дом № 23 ТЦ;Пн-Вс (09:00-20:00);57,674091;63,066954
GN58;Крнд Московская;350000, Краснодарский край, Краснодар г, Московская ул, дом № 65, кв.2;Пн-Вс (09:00-21:00);45,062642;39,001468
MT36;ТЦ Депо Молл ЕС;127322, Москва г, Яблочкова ул 19Г;Пн-Вс (10:00-20:00);55,81911;37,57809
MX83;XL-4 ЕС;127486, Москва г, Дмитровское ш 89;Пн-Вс (10:00-22:00);55,86375;37,54467
S045;Архск Вельск Дзержинского ЕС;165150, Вельск г, Дзержинского ул 62д;Пн-Вс (09:00-19:00);61,0722;42,11394
S560;СПб Лента Петергофское ЕС;190000, Санкт-Петербург г, Петергофское ш 98;Пн-Вс (10:00-21:00);59,85169;30,09352
LR72;КО Таштагол;652992, Кемеровская обл, Таштагольский р-н, Таштагол г, Поспелова ул, место № 10;Пн-Вс (09:00-20:00);52,75902;87,84854
YA60;Воронеж36;394000, Воронежская обл, Воронеж г, Гк Жилая Зона тер, Героев Сибиряков ул, дом № 65, корпус а;Пн-Вс (09:00-21:00);51,646008;39,13914
R089;Ярцево3 ЕС;215800, Ярцево г, Советская ул 12В;Пн-Вс (09:00-20:00);55,06796;32,68906
LR31;КО Бачатский2;652642, Кемеровская обл, Белово г, Бачатский пгт, Комсомольская ул, дом № 13 в, помещение 3;Пн-Вс (09:00-19:00);54,286787;86,107555
LQ24;Бур Таксимо;671560, Бурятия Респ, Муйский р-н, Таксимо пгт, 70 лет Октября ул, дом № 46а;Пн-Вс (09:00-19:00);56,361062;114,835372
LR42;КО Киселевск ТЦ Кручар;652707, Кемеровская обл, Киселевск г, Томская ул, дом № 20;Пн-Вс (09:00-21:00);53,970689;86,72314
LZ20;Прим Черниговка Центр;692372, Приморский край, Черниговский р-н, Черниговка с, Октябрьская ул, дом № 57;Пн-Вс (09:00-19:00);44,346314;132,57015
LQ53;Ирк Ангарск Музей;665830, Иркутская обл, Ангарск г, 76-й кв-л, дом № 12, помещение № 68;Пн-Вс (09:00-21:00);52,542863;103,896018
YO12;СКТ Макси;167000, Коми Респ, Сыктывкар г, Октябрьский пр-кт, дом № 141 ТРЦ Макси;Пн-Вс (10:00-21:00);61,698661;50,802174
LE08;ПНЗ Нижний Ломов;442153, Пензенская обл, Нижнеломовский р-н, Нижний Ломов г, Сергеева ул, дом № 67 б;Ср-Вс (08:00-20:00);53,53334;43,689155
YR85;СПб ТК Манхэттен;198217, Санкт-Петербург г, Ветеранов пр-кт, дом № 36, корпус 2, литер А;Пн-Вс (10:00-21:00);59,842792;30,247583
GE14;ЯНАО Губкинский2;629830, Ямало-Ненецкий АО, Губкинский г, 1-й мкр, дом № 7 ТЦ Русь;Пн-Вс (09:00-21:00);64,433686;76,468151
LR91;Крск Дивногорск;660910, Красноярский край, Дивногорск г, Бочкина ул, дом № 5а;Пн-Вс (10:00-20:00);55,957363;92,381262
GN19;Крнд Геленджик Магнит;353460, Краснодарский край, Геленджик г, Тельмана ул, дом № 135 ТЦ Мангит;Пн-Вс (09:00-21:00);44,566767;38,090911
GM30;Кчр Черкесск3;369000, Карачаево-Черкесская Респ, Черкесск г, Кавказская ул, дом № 30;Пн-Вс (09:00-20:00);44,232511;42,051448
N424;Ирк Ангарск 80 квартал3 ЕС;665813, Ангарск г, 80 кв-л 1;Пн-Вс (10:00-20:00);52,5412;103,8912
P181;РТ Самара ТЦ Мега Сити ЕС;443011, Самара г, Ново-Садовая ул 160м;Пн-Вс (10:00-22:00);53,22463;50,16829
S973;СПб Ефимова ЕС;190031, Санкт-Петербург г, Ефимова ул 1;Пн-Вс (09:00-22:00);59,92648;30,31905
KD20;КБР Нальчик Толстого ЕС;360000, Нальчик г, Толстого 96;Пн-Вс (08:00-20:00);43,48883;43,60734
L140;ТРЦ Косино Парк;111675, Москва г, Святоозерская ул, владение № 5;Пн-Вс (10:00-20:00);55,715208;37,884086
YO45;Архск Няндома;164200, Архангельская обл, Няндомский р-н, Няндома г, Строителей ул, дом № 14, строение 1 в 13 метрах, северо-восточнее;Пн-Вс (09:00-18:00);61,658102;40,199314
LC19;РТ Стерлитамак ТЦ Гермес;453100, Башкортостан Респ, Стерлитамак г, Мира ул, дом № 2 Б ТЦ Гермес;Пн-Вс (10:00-19:00);53,611806;55,955565
L527;ТРЦ Европарк3;121108, Москва г, Рублевское ш, дом № 62;Пн-Вс (10:00-22:00);55,729865;37,457589
LE27;СРТ Балашов Победы;412302, Саратовская обл, Балашов г, 30 лет Победы ул, дом № 156;Пн-Вс (09:00-21:00);51,548327;43,156557
RF28;Моршанск3 ЕС;393950, Моршанск г, Интернациональная ул 47;Пн-Вс (08:00-19:00);53,4438;41,81132
X437;Амур Архара Ленина1 ЕС;676740, Архара пгт, Ленина ул 105;Пн-Вс (09:00-19:00);49,42131;130,08388
N756;Крск Абан ЕС;663740, Абан п, Пионерская ул 2а;Пн-Вс (09:00-19:00);56,67594;96,06732
P762;ПНЗ Кузнецк ТЦ Гулливер2 ЕС;442500, Кузнецк г, Белинского ул 82Б;Пн-Вс (09:00-22:00);53,11744;46,58807
R201;Брянск Пересвета ЕС;241000, Брянск г, Пересвета ул 1А;Пн-Вс (09:00-19:00);53,23789;34,34697
S453;Архск Нарьян-Мар ТЦ Элит Сити ЕС;166000, Нарьян-Мар г, Ленина ул 42;Пн-Вс (10:00-21:00);67,63633;52,98679
S623;СПб Тосно Советская ЕС;187000, Тосно г, Советская ул 3;Пн-Вс (09:00-21:00);59,54291;30,88187
RH01;Чернянка ЕС;Чернянка п, Октябрьская пл 11;Пн-Вс (09:00-19:00);50,94284;37,80441
W505;РТ Глазов Свободы ЕС;427630, Глазов г, Свободы площадь 1;Пн-Вс (10:00-20:00);58,14023;52,67732
K153;КЧР Черкесск Ленина2 ЕС;369394, Черкесск г, Ленина ул 73;Пн-Вс (09:00-21:00);44,21878;42,0459
YC95;Сураж2;243500, Брянская обл, Суражский р-н, Сураж г, Ленина ул, дом № 58;Пн-Вс (09:00-19:00);53,014295;32,395971
LP02;Якутия Алдан Центр;678900, Саха /Якутия/ Респ, Алданский у, Алдан г, 10 лет Якутии ул, дом № 9;Пн-Пт (09:00-20:00);58,612355;125,389667
LC05;РТ Сарапул Азина;427964, Удмуртская Респ, Сарапул г, Азина ул, дом № 87, нежилое помещение №6;Пн-Вс (10:00-20:00);56,461338;53,804407
LR09;Ирк Усть-Илимск Дружбы Народов 2;666682, Иркутская обл, Усть-Илимск г, Мира пр-кт, дом № 41б;Пн-Вс (10:00-19:40);57,942427;102,734604
K730;РнД Миллерово Толстого ЕС;346130, Миллерово г, Толстого ул 44;Пн-Вс (08:00-20:00);48,92494;40,40025
LZ44;Якутск ТЦ Гранд Сити;677000, Саха /Якутия/ Респ, Якутск г, Федора Попова ул, дом № 15;Пн-Вс (10:00-20:00);62,04459;129,75166
K683;Крнд Тимашевск Красная ЕС;352700, Тимашевск г, Красная ул 107 / Братская ул 158;Пн-Вс (08:00-20:00);45,61181;38,93347
S465;СПб Петродворец3 ЕС;198516, Санкт-Петербург г, Санкт-Петербургский пр-кт 60;Пн-Вс (10:00-21:00);59,88193;29,89272
X103;Хабаровск Суворова1 ЕС;Хабаровск г, Суворова ул -;Пн-Вс (10:00-21:00);48,39372;135,13344
LT56;Хкс Сорск;655111, Хакасия Респ, Сорск г, Кирова ул, дом № 11;Пн-Пт (10:00-19:00), Сб-Вс (10:00-18:00);54,00333;90,24667
KG38;Крнд Отрадная Первомайская ЕС;352290, Отрадная ст-ца, Первомайская ул 77;Пн-Вс (08:00-18:00);44,39676;41,51163
N482;Крск Дудинка Островского2 ЕС;647000, Дудинка г, Островского ул 16;Пн-Вс (12:00-19:00);69,40834;86,18166
L554;Балашиха ТЦ Светофор2;143900, Московская обл, Балашиха г, Энтузиастов ш, дом № 1Б ТЦ Светофор;Пн-Вс (10:00-22:00);55,794274;37,926578
YS52;СПб Невский проспект34;190000, Санкт-Петербург г, Невский проспект, дом № 32-34, литера A;Пн-Вс (09:00-22:00);59,935511;30,329046
GN60;Крнд Новокубанск2;352240, Краснодарский край, Новокубанский р-н, Новокубанск г, Первомайская ул, дом № 191;Пн-Вс (08:00-20:00);45,101385;41,048734
L555;Химки ТЦ Лига;141408, Московская обл, Химки г, Ленинградское ш, владение № 5 ТЦ Лига;Пн-Вс (10:00-22:00);55,888765;37,433526
P761;ПНЗ Сердобск Ленина ЕС;442890, Сердобск г, Ленина ул 79А;Пн-Вс (09:00-20:00);52,45462;44,20644
R407;Трубчевск ЕС;242221, Трубчевск г, Брянская ул 62;Пн-Вс (09:00-20:00);52,58027;33,76525
LE76;РТ Стерлитамак ТЦ Арбат2;453100, Башкортостан Респ, Стерлитамак г, Артема ул, дом № 96 ТЦ Арбат;Пн-Вс (10:00-21:00);53,62285;55,901585
YD85;Навля3;242130, Брянская обл, Навлинский р-н, Навля рп, Советская ул, дом № 3;Пн-Вс (09:00-19:00);52,82318;34,49573
N952;Нсиб ТЦ Сан СИТИ2 ЕС;630064, Новосибирск г, Карла Маркса пл 7;Пн-Вс (10:00-22:00);54,9804;82,89817
R120;Малоярославец3 ЕС;249090, Малоярославец г, 17 стрелковой дивизии ул 2а/6;Пн-Вс (09:00-20:00);55,0073;36,47995
X628;Якутия Майя1 ЕС;678070, Майя с, Степанова ул 5;Пн-Вс (09:00-19:00);61,73987;130,27423
S995;СКТ Микунь ТРЦ Провинция ЕС;169060, Микунь г, Ленина ул 34;Пн-Вс (09:15-19:00);62,35625;50,07588
L142;ТРЦ Мозаика;115193, Москва г, Кожуховская 7-я ул, дом № 9;Пн-Вс (10:00-22:00);55,710655;37,675435
GN89;Крнд Сочи Кудепста;354066, Краснодарский край, Сочи г, Хостинский район, Сухумское шоссе ул, дом № 52/2, стр. 7-8;Пн-Вс (09:00-20:00);43,494313;39,888876
N144;Алтай Барнаул ТЦ Огни2 ЕС;656054, Барнаул г, Антона Петрова ул 219Б;Пн-Вс (10:00-22:00);53,35949;83,6985
LP96;Хабаровск 60 лет Октября;"680014, Хабаровский край, Хабаровск г, 60-летия Октября пр-кт, остановка городского транспорта ""Южнопортовая""";Пн-Вс (10:00-20:00);48,470668;135,118474
LQ52;Ирк Ангарск 80 квартал2;665813, Иркутская обл, Ангарск г, 80-й кв-л, дом № 1, помещение 67а;Пн-Вс (09:00-19:00);52,540994;103,890551
L386;Павловский Посад5;142500, Московская обл, Павлово-Посадский р-н, Павловский Посад г, Привокзальная ул, дом № 19;Пн-Вс (09:00-21:00);55,776893;38,675739
GC35;Тмн Тобольск Жемчужина;626157, Тюменская обл, Тобольск г, 7-й мкр, дом № 30 ТЦ Жемчужина Сибири;Пн-Вс (10:00-22:00);58,231145;68,270812
GC43;Тмн Ялуторовск Ретро;627010, Тюменская обл, Ялуторовский р-н, Ялуторовск г, Ленина ул, дом № 17, строение 2 ТЦ Ретро;Пн-Вс (09:00-19:00);56,6527;66,316194
L301;Королев8;141075, Московская обл, Королев г, Космонавтов пр-кт, у дома 20/35;Пн-Вс (10:00-21:00);55,914323;37,865757
YB26;Киржач;601010, Владимирская обл, Киржач г, Гагарина ул, дом № 28;Пн-Вс (09:00-18:00);56,161779;38,873498
YO73;Калин Гусев;238050, Калининградская обл, Гусевский р-н, Гусев г, Менделеева ул, дом № 5Б;Пн-Вс (09:00-20:00);54,586026;22,197409
GE11;ЯНАО Вынгапуровский;629828, Ямало-Ненецкий АО, Ноябрьск г, Вынгапуровский мкр, Ленина ул, дом № 16;Пн-Вс (10:00-20:00);62,981856;76,99887
K113;Крнд Полтавская Интернациональная;353800, Полтавская ст-ца, Интернациональная ул 190;Пн-Вс (08:00-19:00);45,3686;38,21374
YC93;Суджа;307800, Курская обл, Суджанский р-н, Суджа г, Привокзальная площадь;Пн-Вс (09:00-19:00);51,205436;35,309668
LR17;Ирк Шелехов Былина2;666034, Иркутская обл, Шелехов г, 6-й кв-л, в районе ООО Былина;Пн-Вс (09:00-21:00);52,209024;104,091764
L112;Рязанский проспект5;109377, Москва г, Рязанский пр-кт, дом № 46, строение 1 1 этаж и подвал, помещения на плане БТИ 1, 1а, 2, 3, 4;Пн-Вс (09:00-22:00);55,717345;37,791929
LE23;СРТ Балаково Рокот;413841, Саратовская обл, Балаково г, Комарова ул, дом № 135/14;Пн-Вс (09:00-19:00);52,005137;47,790718
YR79;СПб Тельмана ТК Ока;187032, Ленинградская обл, Тосненский р-н, Тельмана п, дом № 2б, литера А ТК Ока. 1 этаж, место 25;Пн-Вс (10:00-22:00);59,719429;30,620225
YB33;Козельск;249722, Калужская обл, Козельский р-н, Козельск г, Старая Казачья ул, дом № 28;Пн-Вс (09:00-19:00);54,035068;35,793796
LP76;Камч Петропавловск ТЦ Комсомольская;683003, Камчатская обл, Петропавловск-Камчатский г, Ленинградская ул, дом № 49;Пн-Вс (10:00-20:00);53,036582;158,655038
GN61;Крнд Новомихайловский2;352855, Краснодарский край, Туапсинский р-н, Новомихайловский пгт, Мира ул, дом № 76;Пн-Вс (08:00-20:00);44,253581;38,846729
L212;Аэропорт Домодедово;142015, Московская обл, Домодедово г, Аэропорт Домодедово тер, стр 1 2 этаж, Внутренний вылет;Пн-Вс (00:01-23:59);55,41509;37,902078
GC44;Тмн Ямская2;625001, Тюменская обл, Тюмень г, Ямская ул, (район дома №87);Пн-Вс (09:00-21:00);57,158069;65,487459
N405;Ирк Шелехов 4 микрорайон2 ЕС;666036, Шелехов г, 4 мкр 9;Пн-Вс (09:00-21:00);52,20939;104,06324
GC10;Тмн Боровский;625504, Тюменская обл, Тюменский р-н, Боровский рп, Советская ул, дом № 23 А;Пн-Вс (09:00-19:00);57,045766;65,717324
LC13;РТ Сорочинск К.Маркса;461900, Оренбургская обл, Сорочинск г, Карла Маркса ул, дом № 7;Пн-Вс (10:00-20:00);52,431849;53,159328
L186;ТЦ Столица-Солнцево;119620, Москва г, Солнцевский пр-кт, дом № 21;Пн-Вс (10:00-22:00);55,64705;37,411763
LE64;РТ Гай Орская;462631, Оренбургская обл, Гай г, Орская ул, дом № 111, корпус А;Пн-Пт (10:00-19:00), Сб (10:00-18:00), Вс (10:00-17:00);51,458475;58,446571
RH38;Лебедянь2 ЕС;399610 Липецкая обл г Лебедянь ул Мира д 7;Пн-Вс (09:00-19:00);53,0107;39,13175
P089;РТ Алексеевка ЕС;446441, Алексеевка п, Невская ул 17Б;Пн-Вс (08:30-19:30);53,25398;50,48076
LR52;КО Нкуз Бардина;654041, Кемеровская обл, Новокузнецк г, Бардина пр-кт, дом № 2 пом.№2;Пн-Вс (09:00-21:00);53,747617;87,119807
LQ17;Алтай Барнаул ТЦ Огни;656000, Алтайский край, Барнаул г, Антона Петрова ул, дом № 219, корпус Б;Пн-Вс (10:00-22:00);53,359135;83,697961
YO10;СКТ Коммунистическая19;167000, Коми Респ, Сыктывкар г, Коммунистическая ул, дом № 19а;Пн-Вс (09:00-21:00);61,666818;50,82999
L451;ТЦ ОКЕЙ Путилково;143441, Московская обл, Красногорский р-н, у деревни Путилково (71 км МКАД);Пн-Вс (10:00-21:00);55,86432;37,397241
W158;РТ Волжск Ленина58 ЕС;425009, Волжск г, Ленина ул 58 блок Б2;Пн-Вс (09:00-20:00);55,86599;48,35907
S338;Вновг Пестово Советская ЕС;174510, Пестово г, Советская ул 2А;Пн-Вс (09:00-20:00);58,60135;35,79917
L327;Лыткарино3;140080, Московская обл, Лыткарино г, Парковая ул, дом № стр. 2;Пн-Вс (10:00-22:00);55,582023;37,912252
LS59;Нсиб ТЦ Магелан2;630066, Новосибирская обл, Новосибирск г, Комсомольская ул, дом № 10;Пн-Вс (10:00-19:30);54,957505;82,964591
YA38;Верхнеднепровский;215750, Смоленская обл, Дорогобужский р-н, Верхнеднепровский пгт, Химиков пр-кт, дом № 1г;Пн-Вс (09:00-20:00);54,978987;33,335982
GN28;СО Владикавказ Алан;362045, Северная Осетия - Алания Респ, Владикавказ г, Владикавказская ул, дом № 26/4;Пн-Вс (08:00-20:00);43,049395;44,6322
LP20;Амур Благовещенск ТЦ Острова;675000, Амурская обл, Благовещенск г, Мухина ул, дом № 114, помещение 20004;Пн-Вс (10:00-22:00);50,281303;127,512482
GN78;Крнд Полтавская2;353800, Краснодарский край, Красноармейский р-н, Полтавская ст-ца, Интернациональная ул, дом № 176 А;Пн-Вс (08:00-20:00);45,367722;38,208252
LC66;РТ Уфа Бульвар Славы2;450075, Башкортостан Респ, Уфа г, Октября пр-кт, рядом с домом №123;Пн-Вс (09:00-21:00);54,789719;56,03475
L113;Савеловский рынок;127018, Москва г, Сущевский Вал ул, дом № 5 строение 5;Пн-Вс (09:00-21:00);55,793857;37,590323
YC86;Старица;171361, Тверская обл, Старицкий р-н, Старица г, Володарского ул, дом № 15;Пн-Вс (09:00-19:00);56,515561;34,935196
LQ88;Ирк Саянск Советская;666303, Иркутская обл, Саянск г, Строителей мкр, дом № 41д;Пн-Вс (10:00-21:00);54,113555;102,174659
LC69;РТ Уфа Достоевского 000;450077, Башкортостан Респ, Уфа г, Достоевского ул, дом № 64;Пн-Вс (09:00-21:00);54,733322;55,94942
LZ56;Хабаровск ТЦ Броско Молл;680000, Хабаровский край, Хабаровск г, Пионерская ул, дом № 2, корпус в ТРЦ Броско-Молл;Пн-Вс (10:00-22:00);48,462456;135,07877
KI29;Влд Октябрь Кооперативная ЕС;404321, Октябрьский рп, Кооперативная ул 5А;Пн-Вс (08:00-18:00);47,9684;43,6457
GE51;Пермь Октябрьский ТЦ Центр;617860, Пермский край, Октябрьский, Трактовая ул, дом № 22;Пн-Сб (10:00-19:00), Вс (10:00-18:00);56,51751;57,205094
WF74;РТ Казань Франт ЕС;420140, Татарстан Респ, Казань г, Юлиуса Фучика ул, 90;Пн-Вс (10:00-22:00);55,763478;49,233274
U301;Крг Куйбышева1 ЕС;640018, Курган г, Куйбышева ул 74д;Пн-Вс (09:00-21:00);55,43866;65,35811
W147;РТ Чебоксары Эгерский ЕС;428000, Чебоксары г, Эгерский б-р 33Б;Пн-Вс (09:00-21:00);56,09904;47,2825
P602;РТ Тюльган ЕС;462010, Тюльган п, Кирова ул 6А;Пн-Вс (09:00-19:00);52,34273;56,15691
NE62;Крск Уяр3 ЕС;663920, Уяр г, Ленина ул 83;Пн-Вс (09:00-20:00);55,81035;94,32691
GC24;Тмн Омутинское;627070, Тюменская обл, Омутинский р-н, Омутинское с, Шоссейная ул, дом № 48;Пн-Вс (09:00-19:00);56,47698;67,667662
LE71;РТ Чебоксары МТВ2;Чувашская Республика, Чебоксары, проспект Ивана Яковлева, 4Б;Пн-Сб (10:00-21:00), Вс (10:00-20:00);56,101976;47,265874
KD57;РСО Владикавказ Ватутина ЕС;362002, Владикавказ г, Ватутина 62-72;Пн-Вс (09:00-20:00);43,03144;44,69029
YD66;Воронеж ТРЦ Московский;"394005, Воронежская обл, Воронеж г, Московский пр-кт, 129/1 ТРЦ ""Московский""";Пн-Вс (10:00-22:00);51,717747;39,177533
L543;ТЦ Prime Plaza;117303, Москва г, Каховка ул, дом № 29, строение А ТЦ Prime Plaza;Пн-Вс (10:00-22:00);55,656273;37,569606
L558;Арбат2;119002, Москва г, Арбат ул, дом № 25/36;Пн-Вс (11:00-21:00);55,750099;37,594773
RH67;Орел ТЦ Линия2 ЕС;302014, Орел г, Карачевское шоссе 74;Пн-Вс (09:00-21:00);52,94734;36,03218
L539;ТЦ Водный3;125130, Москва г, Головинское ш, дом № 5 ТЦ Водный;Пн-Вс (10:00-22:00);55,840245;37,492024
GD51;Члб Магнитогорск ТЦ Континент;455000, Челябинская обл, Магнитогорск г, Ленина пр-кт, дом № 83 ТРК Континент;Пн-Вс (10:00-21:00);53,403343;58,987449
W122;Кир Слободской Советская ЕС;613150, Слободской г, Советская ул 79;Пн-Сб (09:00-20:00), Вс (09:00-19:00);58,73062;50,18219
L345;Монино;141171, Московская обл, Щелковский р-н, Монино рп, Железнодорожная ул, дом № 1;Пн-Вс (09:00-21:00);55,844123;38,198788
L387;Павловский Посад6;142500, Московская обл, Павлово-Посадский р-н, Павловский Посад г, Большая Покровская ул, дом № 35;Пн-Вс (09:00-21:00);55,771442;38,652049
GN01;Крнд Апшеронск3;352690, Краснодарский край, Апшеронский р-н, Апшеронск г, Кооперативная ул, дом № 1/5, литер А;Пн-Вс (08:00-20:00);44,458395;39,745702
YA05;Тамбов18 SvStore;392000, Тамбовская обл, Тамбов г, Советская ул, дом № 99а ТРЦ Рио;Пн-Вс (10:00-22:00);52,724243;41,456959
GC11;Тмн Вояж;625000, Тюменская обл, Тюмень г, Герцена ул, дом № 94 ТЦ Галерея Вояж;Пн-Вс (10:00-22:00);57,146333;65,542377
NE66;Хкс Шира ЕС;655200, Шира с, Щетинина 113 Д;Пн-Вс (09:00-19:00);54,48944;89,96187
YD14;Тейково;155040, Ивановская обл, Тейковский р-н, Тейково г, Октябрьская ул, дом № 1;Пн-Вс (09:30-19:00);56,656267;40,377763
LQ67;Ирк Братск Колизей;665724, Иркутская обл, Братск г, Центральный жилрайон, Крупской ул, дом № 14;Пн-Вс (10:00-20:00);56,173129;101,609488
LR46;КО Ленинск-Кузнецкий ТЦ Фабрика;652523, Кемеровская обл, Ленинск-Кузнецкий г, Телефонная ул, дом № 13;Пн-Вс (09:00-20:00);54,708021;86,194746
LP65;Амур Новобурейский;676722, Амурская обл, Бурейский р-н, Новобурейский пгт, Советская ул, дом № 37, помещение 11;Пн-Вс (09:00-19:00);49,793601;129,878059
LP38;Сахалин Долинск Центр;694050, Сахалинская обл, Долинский р-н, Долинск г, Хабаровская ул, дом № 3, помещение 2;Пн-Вс (09:00-20:00);47,326286;142,792982
